NDB_No,Descrip,Energy_kcal,Protein_g,Fat_g,Carb_g,Fiber_g,Sugar_g,zero_in
20051,rice white medium-grain enr ckd,130.0,2.38,0.21,28.59,0.3,0.0,Sugar_g
20052,rice white short-grain enr unckd,358.0,6.5,0.52,79.15,2.8,0.0,Sugar_g
20053,rice white short-grain enr ckd,130.0,2.36,0.19,28.73,0.0,0.0,"Fiber_g, Sugar_g"
20054,rice white glutinous unenr unckd,370.0,6.81,0.55,81.68,2.8,0.0,Sugar_g
20058,rice white stmd chinese restaurant,151.0,3.2,0.27,33.88,0.9,0.0,Sugar_g
20066,semolina enriched,360.0,12.68,1.05,72.83,3.9,0.0,Sugar_g
20069,triticale,336.0,13.05,2.09,72.13,0.0,0.0,"Fiber_g, Sugar_g"
20070,triticale flr whole-grain,338.0,13.18,1.81,73.14,14.6,0.0,Sugar_g
20076,wheat durum,339.0,13.68,2.47,71.13,0.0,0.0,"Fiber_g, Sugar_g"
20078,wheat germ crude,360.0,23.15,9.72,51.8,13.2,0.0,Sugar_g
20086,wheat flr white tortilla mix enr,405.0,9.66,10.63,67.14,0.0,0.0,"Fiber_g, Sugar_g"
20087,wheat sprouted,198.0,7.49,1.27,42.53,1.1,0.0,Sugar_g
20091,pasta gluten-free corn dry,357.0,7.46,2.08,79.26,11.0,0.0,Sugar_g
20092,pasta gluten-free corn ckd,126.0,2.63,0.73,27.91,4.8,0.0,Sugar_g
20093,pasta fresh-refrigerated pln as purchased,288.0,11.31,2.3,54.73,0.0,0.0,"Fiber_g, Sugar_g"
20094,pasta fresh-refrigerated pln ckd,131.0,5.15,1.05,24.93,0.0,0.0,"Fiber_g, Sugar_g"
20095,pasta fresh-refrigerated spinach as purchased,289.0,11.26,2.1,55.72,0.0,0.0,"Fiber_g, Sugar_g"
20096,pasta fresh-refrigerated spinach ckd,130.0,5.06,0.94,25.04,0.0,0.0,"Fiber_g, Sugar_g"
20097,pasta homemade made wegg ckd,130.0,5.28,1.74,23.54,0.0,0.0,"Fiber_g, Sugar_g"
20098,pasta homemade made woegg ckd,124.0,4.37,0.98,25.12,0.0,0.0,"Fiber_g, Sugar_g"
20105,macaroni veg enr dry,367.0,13.14,1.04,74.88,4.3,0.0,Sugar_g
20111,noodles egg spinach enr dry,382.0,14.61,4.55,70.32,6.8,0.0,Sugar_g
20114,noodles japanese soba dry,336.0,14.38,0.71,74.62,0.0,0.0,"Fiber_g, Sugar_g"
20115,noodles japanese soba ckd,99.0,5.06,0.1,21.44,0.0,0.0,"Fiber_g, Sugar_g"
20116,noodles japanese somen dry,356.0,11.35,0.81,74.1,4.3,0.0,Sugar_g
20117,noodles japanese somen ckd,131.0,4.0,0.18,27.54,0.0,0.0,"Fiber_g, Sugar_g"
20127,spaghetti spinach cooked,130.0,4.58,0.63,26.15,0.0,0.0,"Fiber_g, Sugar_g"
20141,spelt ckd,127.0,5.5,0.85,26.44,3.9,0.0,Sugar_g
20143,teff ckd,101.0,3.87,0.65,19.86,2.8,0.0,Sugar_g
20314,corn grain white,365.0,9.42,4.74,74.26,0.0,0.0,"Fiber_g, Sugar_g"
20315,corn flr whole-grain blue (harina de maiz morado),364.0,8.75,5.09,73.89,8.4,0.0,Sugar_g
20317,corn flr yel masa enr,363.0,8.46,3.69,76.59,6.4,0.0,Sugar_g
20323,cornmeal white self-rising bolted pln enr,334.0,8.28,3.4,70.28,6.7,0.0,Sugar_g
20324,cornmeal white self-rising bolted w wheat flr added enr,348.0,8.41,2.85,73.43,6.3,0.0,Sugar_g
20325,cornmeal white self-rising degermed enr,355.0,8.41,1.72,74.79,7.1,0.0,Sugar_g
20330,hominy canned yellow,72.0,1.48,0.88,14.26,2.5,0.0,Sugar_g
20381,wheat flr white all-purpose enr calcium-fortified,364.0,10.33,0.98,76.31,2.7,0.0,Sugar_g
20450,rice white medium-grain raw unenr,360.0,6.61,0.58,79.34,0.0,0.0,"Fiber_g, Sugar_g"
20451,rice white medium-grain ckd unenr,130.0,2.38,0.21,28.59,0.0,0.0,"Fiber_g, Sugar_g"
20452,rice white short-grain raw unenr,358.0,6.5,0.52,79.15,0.0,0.0,"Fiber_g, Sugar_g"
20453,rice white short-grain ckd unenr,130.0,2.36,0.19,28.73,0.0,0.0,"Fiber_g, Sugar_g"
20466,semolina unenriched,360.0,12.68,1.05,72.83,3.9,0.0,Sugar_g
20523,spaghetti protein-fortified ckd enr (n x 625),164.0,8.86,0.21,30.88,2.0,0.0,Sugar_g
20622,spaghetti protein-fortified dry enr (n x 625),374.0,21.78,2.23,65.65,2.4,0.0,Sugar_g
20623,wheat flr white (industrial) 9 prot bleached enr,367.0,8.89,1.43,77.32,0.0,0.54,Fiber_g
20650,sorghum flr refined unenr,357.0,9.53,1.24,76.85,1.9,0.0,Sugar_g
20654,pasta gluten-free brown rice flr ckd tinkyada,138.0,3.46,1.67,32.2,1.7,0.0,Sugar_g
20656,pasta gluten-free rice flr  rice bran extract ckd de boles,200.0,4.21,1.7,40.75,1.9,0.0,Sugar_g
20657,pasta gluten-free corn  rice flr ckd,179.0,3.2,1.0,38.05,1.4,0.0,Sugar_g
21002,fast foods  biscuit  w egg,274.0,8.53,16.23,23.46,0.6,0.0,Sugar_g
21006,fast foods biscuit w egg  steak,277.0,12.12,19.21,14.37,0.0,0.0,"Fiber_g, Sugar_g"
21011,fast foods croissant weggchs,304.0,10.07,19.45,22.45,0.0,0.0,"Fiber_g, Sugar_g"
21018,fast foods egg scrambled,212.0,13.84,16.18,2.08,0.0,1.64,Fiber_g
21023,fast foods french toast w butter,264.0,7.66,13.9,26.7,0.0,0.0,"Fiber_g, Sugar_g"
21032,fast foods sundae caramel,196.0,4.71,5.98,31.81,0.0,0.0,"Fiber_g, Sugar_g"
21033,fast foods sundae hot fudge,180.0,3.57,5.46,30.17,0.0,0.0,"Fiber_g, Sugar_g"
21034,fast foods sundae strawberry,175.0,4.09,5.13,29.18,0.0,0.0,"Fiber_g, Sugar_g"
21060,fast foods burrito wbns,206.0,6.48,6.22,32.92,0.0,0.0,"Fiber_g, Sugar_g"
21083,fast foods taco salad,141.0,6.68,7.46,11.91,0.0,0.0,"Fiber_g, Sugar_g"
21093,fast foods cheeseburger; double reg patty w condmnt  veg,251.0,12.8,12.7,21.2,0.0,0.0,"Fiber_g, Sugar_g"
21095,fast foods chseburger; dble reg patty  bn; w condmnt  veg,285.0,13.04,15.47,23.3,0.0,0.0,"Fiber_g, Sugar_g"
21099,fast foods chsburger; single lrg patty; w condmnt veg  ham,286.0,15.55,18.97,13.01,0.0,0.0,"Fiber_g, Sugar_g"
21100,fast foods cheeseburger; double lrg patty w condmnt  veg,273.0,14.72,16.92,15.37,0.0,0.0,"Fiber_g, Sugar_g"
21109,fast foods hamburger; single reg patty; w condmnt  veg,254.0,11.74,12.25,24.81,0.0,0.0,"Fiber_g, Sugar_g"
21111,fast foods hamburger; double reg patty; w condmnt,268.0,14.8,15.1,18.02,0.0,0.0,"Fiber_g, Sugar_g"
21112,fast foods hamburger; single lrg patty; pln,311.0,16.51,16.73,23.16,0.0,0.0,"Fiber_g, Sugar_g"
21113,fast foods hamburger; single lrg patty; w condmnt  veg,235.0,11.85,12.55,18.35,0.0,0.0,"Fiber_g, Sugar_g"
21114,fast foods hamburger; double lrg patty; w condmnt  veg,239.0,15.17,11.75,17.82,0.0,0.0,"Fiber_g, Sugar_g"
21115,fast foods hamburger lrg triple patty wcondmnt,267.0,19.3,16.01,11.04,0.0,0.0,"Fiber_g, Sugar_g"
21118,fast foods hotdog plain,247.0,10.6,14.84,18.4,0.0,0.0,"Fiber_g, Sugar_g"
21119,fast foods hotdog wchili,260.0,11.85,11.79,27.45,0.0,0.0,"Fiber_g, Sugar_g"
21120,fast foods hotdog wcorn flr coating (corndog),263.0,9.6,10.8,31.88,0.0,0.0,"Fiber_g, Sugar_g"
21140,side dishes potato salad,114.0,1.53,6.03,13.53,0.0,0.0,"Fiber_g, Sugar_g"
21141,burger king vanilla shake,168.0,3.19,8.74,19.03,0.0,11.67,Fiber_g
21239,wendy's classic single hamburger no chs,213.0,12.63,10.6,16.82,1.3,0.0,Sugar_g
21240,wendy's classic single hamburger w chs,221.0,14.87,11.6,14.2,1.4,0.0,Sugar_g
21241,wendy's jr hamburger wo chs,243.0,12.62,8.75,28.45,1.7,0.0,Sugar_g
21242,wendy's jr hamburger w chs,256.0,13.06,11.5,24.97,1.4,0.0,Sugar_g
21243,wendy's classic double w chs,241.0,16.52,14.2,11.71,1.1,0.0,Sugar_g
21244,wendy's homestyle chick fillet sndwch,214.0,13.78,8.1,21.55,1.3,0.0,Sugar_g
21245,wendy's ultimate chick grill sndwch,179.0,14.73,5.0,18.88,1.1,0.0,Sugar_g
21246,wendy's chick nuggets,326.0,16.46,22.55,14.31,0.0,0.08,Fiber_g
21248,wendy's frosty dairy dssrt,132.0,3.49,2.6,23.62,3.3,0.0,Sugar_g
21256,burger king chick strips,292.0,18.2,15.25,20.49,1.3,0.0,Sugar_g
21263,taco bell soft taco w steak,225.0,11.81,12.1,17.22,1.6,0.0,Sugar_g
21266,taco bell burrito supreme w chick,179.0,9.84,6.42,20.51,2.4,0.0,Sugar_g
21267,taco bell burrito supreme w steak,183.0,9.13,7.27,20.32,2.4,0.0,Sugar_g
21270,taco bell taco salad,170.0,6.69,9.17,15.1,3.0,0.0,Sugar_g
21309,mcdonald's chick mcnuggets,302.0,15.79,19.81,15.09,0.0,0.08,Fiber_g
21311,mcdonald's creamy ranch sau,468.0,1.11,52.03,3.49,0.0,3.45,Fiber_g
21314,mcdonald's spicy buffalo sau,142.0,0.54,15.45,1.81,1.5,0.0,Sugar_g
21315,mcdonald's swt 'n sour sau,170.0,0.66,1.09,39.38,0.0,35.79,Fiber_g
21334,mcdonald's strawberry sundae,158.0,3.19,3.95,28.09,0.0,25.32,Fiber_g
21335,mcdonald's hot caramel sundae,188.0,3.58,4.89,33.36,0.0,23.54,Fiber_g
21337,mcdonald's pnuts (for sundaes),640.0,28.04,52.91,16.23,0.0,4.15,Fiber_g
21343,mcdonald's lofat caramel sau,313.0,1.89,3.25,71.53,0.0,43.21,Fiber_g
21393,fast foods hmburgr; sng reg ptty; dbl bn w cndmnt  spl sau,259.0,12.17,13.3,22.69,1.4,0.0,Sugar_g
21417,popeyes mild chick strips analyzed 2006,271.0,19.2,13.01,19.31,0.8,0.0,Sugar_g
21418,popeyes spicy chick strips analyzed 2006,253.0,19.61,11.2,18.52,1.2,0.0,Sugar_g
21421,kfc crispy chick strips,274.0,20.25,15.42,13.66,1.4,0.0,Sugar_g
21422,kfc popcorn chick,351.0,17.67,21.74,21.18,1.0,0.0,Sugar_g
21424,kfc fried chick original recipe skn  breading,384.0,14.17,28.01,18.79,0.0,0.0,"Fiber_g, Sugar_g"
21425,kfc fried chick original recipe breast meat nly skn brdng rd,149.0,26.89,4.56,0.0,0.0,0.0,"Carb_g, Fiber_g, Sugar_g"
21426,kfc fried chick original recipe drumstk meat only skn brg rd,175.0,26.3,7.66,0.11,0.0,0.0,"Fiber_g, Sugar_g"
21427,kfc fried chick original recipe thigh meat only skn brdng rd,175.0,22.78,9.31,0.01,0.0,0.0,"Fiber_g, Sugar_g"
21428,kfc fried chick original recipe wing meat only skn brdng rd,216.0,28.65,10.49,1.76,0.0,0.0,"Fiber_g, Sugar_g"
21429,kfc fried chick ex crispy skn  breading,464.0,10.96,36.61,22.54,1.5,0.0,Sugar_g
21430,kfc fried chick ex crispy breast meat only skn  brding rmvd,153.0,27.25,4.82,0.25,0.0,0.0,"Fiber_g, Sugar_g"
21431,kfc fried chick ex crispy drumstk meat only skn  brdng rmvd,170.0,25.9,7.43,0.0,0.0,0.0,"Carb_g, Fiber_g, Sugar_g"
21432,kfc fried chick ex crispy thigh meat only skn  brding rmvd,179.0,22.41,9.96,0.0,0.0,0.0,"Carb_g, Fiber_g, Sugar_g"
21433,kfc fried chick ex crispy wing meat only skn  brding removd,236.0,28.67,12.13,2.97,0.0,0.0,"Fiber_g, Sugar_g"
21434,kfc fried chick original recipe breast meat  skn w brding,231.0,21.94,13.11,6.28,0.0,0.0,"Fiber_g, Sugar_g"
21435,kfc fried chick original recipe drumstk meat  skn w brding,239.0,22.3,14.22,5.39,0.0,0.0,"Fiber_g, Sugar_g"
21436,kfc fried chick original recipe thigh meat  skn w breading,269.0,18.9,17.73,8.46,0.0,0.0,"Fiber_g, Sugar_g"
21437,kfc fried chick original recipe wing meat  skn w breading,297.0,21.7,18.9,9.93,0.0,0.0,"Fiber_g, Sugar_g"
21438,kfc fried chick ex crispy breast meat  skn w breading,268.0,21.24,16.55,8.47,0.0,0.0,"Fiber_g, Sugar_g"
21439,kfc fried chick ex crispy drumstk meat  skn w breading,274.0,20.62,17.73,7.96,0.0,0.0,"Fiber_g, Sugar_g"
21440,kfc fried chick ex crispy thigh meat  skn w breading,309.0,17.17,22.14,10.3,0.0,0.0,"Fiber_g, Sugar_g"
21441,kfc fried chick ex crispy wing meat  skn w breading,337.0,20.8,23.0,11.66,0.0,0.0,"Fiber_g, Sugar_g"
21442,popeyes  chick mild breast meat only skn  brding removed,157.0,28.98,4.52,0.0,0.0,0.0,"Carb_g, Fiber_g, Sugar_g"
21443,popeyes fried chick mild drumstk meat only skn  breading re,170.0,26.51,7.14,0.04,0.0,0.0,"Fiber_g, Sugar_g"
21444,popeyes fried chick mild skn  breading,433.0,13.96,32.32,21.54,1.0,0.0,Sugar_g
21445,popeyes fried chck mild thigh meat only skn  brding removed,188.0,24.31,9.66,0.85,0.0,0.0,"Fiber_g, Sugar_g"
21446,popeyes fried chick mild wing meat only skn  brding removed,212.0,28.94,9.42,2.9,0.0,0.0,"Fiber_g, Sugar_g"
21456,popeyes fried chick mild breast meat  skn w breading,274.0,21.67,16.47,9.83,0.4,0.0,Sugar_g
21457,popeyes fried chick mild drumstk meat  skn w breading,293.0,20.44,19.14,9.84,0.0,0.0,"Fiber_g, Sugar_g"
21458,popeyes fried chick mild thigh meat  skn w breading,310.0,19.14,20.99,11.2,0.5,0.0,Sugar_g
21459,popeyes fried chick mild wing meat  skn w breading,338.0,20.4,22.48,13.52,0.6,0.0,Sugar_g
21464,fast foods fried chick breast meat only skn  brding removed,153.0,27.93,4.54,0.0,0.0,0.0,"Carb_g, Fiber_g, Sugar_g"
21465,fast foods fried chick drmstk meat only skn  brding removed,172.0,26.24,7.41,0.0,0.0,0.0,"Carb_g, Fiber_g, Sugar_g"
21466,fast foods fried chick thigh meat only skn  breding removed,178.0,23.21,9.41,0.24,0.0,0.0,"Fiber_g, Sugar_g"
21467,fast foods fried chick wing meat only skn  breading removed,215.0,28.77,10.2,2.13,0.0,0.0,"Fiber_g, Sugar_g"
21468,fast foods fried chick skn  breading from all pieces,398.0,14.11,29.22,19.56,0.3,0.0,Sugar_g
21469,fast foods fried chick breast meat  skn  breading,230.0,23.51,12.44,6.03,0.1,0.0,Sugar_g
21470,fast foods fried chick drumstk meat  skn w breading,267.0,21.13,16.92,7.59,0.5,0.0,Sugar_g
21471,fast foods fried chick thigh meat  skn  breading,274.0,19.23,18.07,8.68,0.1,0.0,Sugar_g
21472,fast foods fried chick wing meat  skn  breading,310.0,21.14,20.09,11.19,0.1,0.0,Sugar_g
21473,digiorno pizza chs topping chs stuffed crust frz bkd,279.0,13.48,11.68,29.86,1.9,0.0,Sugar_g
21475,digiorno pizza chs topping thin crispy crust frz bkd,247.0,12.96,9.91,26.47,3.0,0.0,Sugar_g
21476,digiorno pizza pepperoni topping chs stuffed crust frz bkd,279.0,13.92,11.71,29.46,2.1,0.0,Sugar_g
21478,digiorno pizza pepperoni topping thin crispy crust frz bkd,283.0,13.22,12.86,28.67,2.8,0.0,Sugar_g
21480,digiorno pizza supreme topping thin crispy crust frz bkd,255.0,11.41,10.8,28.05,2.8,0.0,Sugar_g
21506,burger king double cheeseburger,282.0,16.83,16.13,17.43,0.0,4.17,Fiber_g
21507,wendy's double stack w chs,285.0,18.53,16.6,15.35,0.0,3.87,Fiber_g
21508,wend'ys crispy chick sndwch,278.0,11.72,13.93,26.36,0.0,3.13,Fiber_g
22528,turkey pot pie frz entree,176.0,6.5,8.8,17.7,1.1,0.0,Sugar_g
22529,beef pot pie frz entree prep,220.0,7.25,11.39,22.05,0.8,0.0,Sugar_g
22915,lasagna w meat  sau low-fat frz entree,101.0,6.81,2.23,13.5,1.3,0.0,Sugar_g
23000,"beef shldr pot rst or stk bnls ln  fat 0"" fat all grds r",130.0,21.39,4.97,0.0,0.0,0.0,"Carb_g, Fiber_g, Sugar_g"
23001,"beef shrt loin prtrhs steak lnfat 18""fat all grds raw",214.0,20.49,14.06,0.0,0.0,0.0,"Carb_g, Fiber_g, Sugar_g"
23002,"beef shrt ln prtrhs stk ln  fat 18"" fat all grds ckd grlld",276.0,25.4,18.57,0.0,0.0,0.0,"Carb_g, Fiber_g, Sugar_g"
23003,"beef shrt loin prtrhs steak lnfat 18""fat sel raw",208.0,20.69,13.27,0.0,0.0,0.0,"Carb_g, Fiber_g, Sugar_g"
23004,"beef shrt loin prtrhs stk l  f 18"" f sel ckd grilled",263.0,26.21,16.75,0.0,0.0,0.0,"Carb_g, Fiber_g, Sugar_g"
23005,"beef shrt loin t-bone steak lnfat 18""fat all grds raw",223.0,20.11,15.18,0.0,0.0,0.0,"Carb_g, Fiber_g, Sugar_g"
23006,"beef shrt ln t-bne stek ln  fat 18"" fat all grds ckd grlld",289.0,24.6,20.36,0.0,0.0,0.0,"Carb_g, Fiber_g, Sugar_g"
23007,"beef shrt loin t-bone steak lnfat 18""fat sel raw",215.0,20.28,14.19,0.0,0.0,0.0,"Carb_g, Fiber_g, Sugar_g"
23008,"beef shrt loin t-bone steak ln  fat 18"" fat sel ckd grlld",281.0,25.18,19.22,0.0,0.0,0.0,"Carb_g, Fiber_g, Sugar_g"
23030,"beef rnd knuckle tip side steak ln  fat 0"" fat choic raw",133.0,21.41,4.66,0.0,0.0,0.0,"Carb_g, Fiber_g, Sugar_g"
23031,"bf rnd knuckle tip side steak ln  fat 0"" fat ch ckd grilled",174.0,28.79,5.71,0.0,0.0,0.0,"Carb_g, Fiber_g, Sugar_g"
23032,"beef rnd knuckle tip side steak ln  fat 0"" fat sel raw",124.0,21.96,3.24,0.0,0.0,0.0,"Carb_g, Fiber_g, Sugar_g"
23033,"bf rnd knuckle tip side steak ln  fat 0"" fat se ckd grilled",160.0,29.24,3.91,0.0,0.0,0.0,"Carb_g, Fiber_g, Sugar_g"
23034,"bf chk clod shldr tender medallion ln  fat 0"" fat choic raw",145.0,20.51,6.36,0.0,0.0,0.0,"Carb_g, Fiber_g, Sugar_g"
23035,"bf chk clod shdr tndr med ln  fat 0"" fat ch ckd grilled",181.0,26.07,7.68,0.0,0.0,0.0,"Carb_g, Fiber_g, Sugar_g"
23036,"bf chk clod shldr tender medallion ln  fat 0"" fat sel raw",142.0,20.93,5.79,0.0,0.0,0.0,"Carb_g, Fiber_g, Sugar_g"
23037,"beef chuck shldr clod top  cntr  stk ln  fat 0"" fat ch raw",143.0,20.39,6.12,0.0,0.0,0.0,"Carb_g, Fiber_g, Sugar_g"
23038,"bf chk shldr clod top  cntr stk ln  fat 0"" fat ch ckd grld",184.0,26.07,8.11,0.0,0.0,0.0,"Carb_g, Fiber_g, Sugar_g"
23039,"bf chuck shldr clod  top  cntr stk ln  fat 0"" fat sel raw",140.0,21.13,5.51,0.0,0.0,0.0,"Carb_g, Fiber_g, Sugar_g"
23040,"bf chk  clod top  cntr stk ln  fat 0"" fat sel ckd grld",176.0,26.66,6.94,0.0,0.0,0.0,"Carb_g, Fiber_g, Sugar_g"
23041,"bf chk shldr clod top blade steak ln  fat 0"" fat choic raw",182.0,18.75,11.33,0.0,0.0,0.0,"Carb_g, Fiber_g, Sugar_g"
23042,"bf chk clod top blade steak ln  fat 0"" fat ch ckd grilled",228.0,24.7,13.59,0.0,0.0,0.0,"Carb_g, Fiber_g, Sugar_g"
23043,"bf chuck shldr clod top blade steak ln  fat 0"" fat sel raw",166.0,19.38,9.22,0.0,0.0,0.0,"Carb_g, Fiber_g, Sugar_g"
23044,"bf chk clod top blade steak ln  fat 0"" fat sel ckd grilled",212.0,25.29,11.52,0.0,0.0,0.0,"Carb_g, Fiber_g, Sugar_g"
23045,"beef rnd knuckle tip cntr steak ln  fat 0"" fat choic raw",150.0,20.74,6.85,0.0,0.0,0.0,"Carb_g, Fiber_g, Sugar_g"
23046,"bf rnd knuckle tip cntr stk ln  fat 0"" fat choic ckd grld",188.0,26.88,8.13,0.0,0.0,0.0,"Carb_g, Fiber_g, Sugar_g"
23047,"beef rnd knuckle tip cntr steak ln  fat 0"" fat sel raw",137.0,20.98,5.21,0.0,0.0,0.0,"Carb_g, Fiber_g, Sugar_g"
23048,"bf rnd knuckle tip cntr steak ln  fat 0"" fat se ckd grilled",162.0,26.61,5.32,0.0,0.0,0.0,"Carb_g, Fiber_g, Sugar_g"
23049,"bf rnd outside rnd bttm rnd steak ln  fat 0"" fat choic raw",150.0,21.24,6.59,0.0,0.0,0.0,"Carb_g, Fiber_g, Sugar_g"
23050,"bf rnd out rnd bttm rnd stk ln  fat 0"" fat ch ckd grilled",191.0,27.22,8.3,0.0,0.0,0.0,"Carb_g, Fiber_g, Sugar_g"
23051,"beef rnd outside rnd bttm rnd steak ln  fat 0"" fat sel raw",129.0,22.15,3.83,0.0,0.0,0.0,"Carb_g, Fiber_g, Sugar_g"
23052,"beef rnd out rnd bttm rnd stk ln  fat 0"" fat sel ckd grld",166.0,28.01,5.17,0.0,0.0,0.0,"Carb_g, Fiber_g, Sugar_g"
23053,"bf chk cld shldr tndr medallion ln  fat 0"" fat all grds raw",144.0,20.54,6.22,0.0,0.0,0.0,"Carb_g, Fiber_g, Sugar_g"
23054,"bf chk cld shdr tndr med ln  fat 0"" fat all grds ck grld",177.0,26.22,7.2,0.0,0.0,0.0,"Carb_g, Fiber_g, Sugar_g"
23055,"beef rnd knuckle tip side steak ln  fat 0"" fat all grds raw",129.0,21.69,4.0,0.0,0.0,0.0,"Carb_g, Fiber_g, Sugar_g"
23056,"bf rnd knuck tip side stk ln  fat 0"" fat all grds ckd grld",168.0,29.08,4.84,0.0,0.0,0.0,"Carb_g, Fiber_g, Sugar_g"
23057,"bf chuck clod top  cntr steak ln  fat 0"" fat all grds raw",141.0,20.67,5.88,0.0,0.0,0.0,"Carb_g, Fiber_g, Sugar_g"
23058,"beef chck clod shldr topcntr stks ln  ft 0"" all grds grld",182.0,26.3,7.66,0.0,0.0,0.0,"Carb_g, Fiber_g, Sugar_g"
23059,"beef chuck clod top blade steak ln  fat 0"" fat all grds raw",176.0,18.99,10.52,0.0,0.0,0.0,"Carb_g, Fiber_g, Sugar_g"
23060,"bf chuck clod top blade stk ln  fat 0"" fat all ckd grld",222.0,24.93,12.79,0.0,0.0,0.0,"Carb_g, Fiber_g, Sugar_g"
23061,"beef rnd knuckle tip cntr steak ln  fat 0"" fat all grds raw",143.0,20.93,5.89,0.0,0.0,0.0,"Carb_g, Fiber_g, Sugar_g"
23062,"bf rnd knuckle tip cntr stk ln  fat 0"" fat all ckd grld",177.0,27.12,6.78,0.0,0.0,0.0,"Carb_g, Fiber_g, Sugar_g"
23063,"bf rnd outside rnd bttm rnd steak ln  fat 0"" fat all raw",142.0,21.59,5.53,0.0,0.0,0.0,"Carb_g, Fiber_g, Sugar_g"
23064,"bf rnd out rnd bttm rnd stk ln  fat 0"" fat all grds ck grld",182.0,27.52,7.1,0.0,0.0,0.0,"Carb_g, Fiber_g, Sugar_g"
23065,"bf chk  clod shldr tender med ln  fat 0"" fat se ckd grilled",172.0,26.45,6.43,0.0,0.0,0.0,"Carb_g, Fiber_g, Sugar_g"
23066,"beef chuck shrt ribs bnless ln 0"" fat choic raw",175.0,19.38,10.7,0.29,0.0,0.0,"Fiber_g, Sugar_g"
23067,"beef chuck shrt ribs bnless ln 0"" fat sel raw",161.0,20.14,8.99,0.0,0.0,0.0,"Carb_g, Fiber_g, Sugar_g"
23068,"beef chuck shrt ribs bnless ln 0"" fat all grds raw",169.0,19.68,10.02,0.05,0.0,0.0,"Fiber_g, Sugar_g"
23069,"beef chuck eye country-style ribs bnless ln 0"" fat choic ckd",234.0,30.95,12.22,0.0,0.0,0.0,"Carb_g, Fiber_g, Sugar_g"
23070,"beef chuck eye country-style ribs bnless ln 0"" fat sel ckd b",221.0,32.1,10.24,0.0,0.0,0.0,"Carb_g, Fiber_g, Sugar_g"
23071,"bf chk eye cntry-stl ribs bnls ln 0"" fat all grds  ckd  brsd",228.0,31.41,11.43,0.0,0.0,0.0,"Carb_g, Fiber_g, Sugar_g"
23072,"beef chuck eye country-style ribs bnless ln 0"" fat choic raw",152.0,20.87,7.67,0.0,0.0,0.0,"Carb_g, Fiber_g, Sugar_g"
23073,"beef chuck eye country-style ribs bnless ln 0"" fat sel raw",137.0,21.1,5.89,0.0,0.0,0.0,"Carb_g, Fiber_g, Sugar_g"
23074,"beef chk eye country-style ribs bnls ln 0"" fat all grds  raw",146.0,20.96,6.95,0.0,0.0,0.0,"Carb_g, Fiber_g, Sugar_g"
23075,"beef chuck eye steak bnless ln 0"" fat choic ckd grilled",215.0,27.97,11.47,0.0,0.0,0.0,"Carb_g, Fiber_g, Sugar_g"
23076,"beef chuck eye steak bnless ln 0"" fat sel ckd grilled",199.0,27.88,9.77,0.0,0.0,0.0,"Carb_g, Fiber_g, Sugar_g"
23077,"beef chuck eye steak bnless ln 0"" fat all grds ckd grilled",209.0,27.94,10.79,0.0,0.0,0.0,"Carb_g, Fiber_g, Sugar_g"
23078,"beef chuck eye steak bnless ln 0"" fat choic raw",160.0,21.31,8.29,0.0,0.0,0.0,"Carb_g, Fiber_g, Sugar_g"
23079,"beef chuck eye steak bnless ln 0"" fat sel raw",143.0,21.28,6.47,0.0,0.0,0.0,"Carb_g, Fiber_g, Sugar_g"
23080,"beef chuck eye steak bnless ln 0"" fat all grds raw",153.0,21.29,7.56,0.0,0.0,0.0,"Carb_g, Fiber_g, Sugar_g"
23081,"beef shldr pot rst bnless ln 0"" fat choic ckd brsd",200.0,31.32,8.3,0.0,0.0,0.0,"Carb_g, Fiber_g, Sugar_g"
23082,"beef shldr pot rst bnless ln 0"" fat sel ckd brsd",190.0,31.71,7.02,0.0,0.0,0.0,"Carb_g, Fiber_g, Sugar_g"
23083,"beef shldr pot rst bnless ln 0"" fat all grds ckd brsd",196.0,31.48,7.78,0.0,0.0,0.0,"Carb_g, Fiber_g, Sugar_g"
23084,"beef chuck mock tender steak bnless ln 0"" fat choic ckd brsd",197.0,33.55,6.94,0.0,0.0,0.0,"Carb_g, Fiber_g, Sugar_g"
23085,"beef chuck mock tender steak bnless ln 0"" fat sel ckd brsd",181.0,32.96,5.44,0.0,0.0,0.0,"Carb_g, Fiber_g, Sugar_g"
23086,"beef chk mock tender stk bnls ln 0"" fat all grds ckd brsd",190.0,33.31,6.34,0.0,0.0,0.0,"Carb_g, Fiber_g, Sugar_g"
23087,"beef chuck mock tender steak bnless ln 0"" fat choic raw",127.0,21.36,4.6,0.0,0.0,0.0,"Carb_g, Fiber_g, Sugar_g"
23088,"beef chuck mock tender steak bnless ln 0"" fat sel raw",117.0,21.22,3.53,0.0,0.0,0.0,"Carb_g, Fiber_g, Sugar_g"
23089,"beef chuck mock tender steak bnless ln 0"" fat all grds raw",123.0,21.3,4.17,0.0,0.0,0.0,"Carb_g, Fiber_g, Sugar_g"
23090,beef chuck for stew ln  fat all grds ckd brsd,191.0,32.41,6.82,0.0,0.0,0.0,"Carb_g, Fiber_g, Sugar_g"
23091,beef chuck for stew ln  fat sel ckd brsd,186.0,32.29,6.34,0.0,0.0,0.0,"Carb_g, Fiber_g, Sugar_g"
23092,beef chuck for stew ln  fat choic ckd brsd,194.0,32.49,7.14,0.0,0.0,0.0,"Carb_g, Fiber_g, Sugar_g"
23093,beef chuck for stew ln  fat all grds raw,128.0,21.75,4.48,0.16,0.0,0.0,"Fiber_g, Sugar_g"
23094,beef chuck for stew ln  fat sel raw,124.0,21.9,3.99,0.21,0.0,0.0,"Fiber_g, Sugar_g"
23095,beef chuck for stew ln  fat choic raw,130.0,21.64,4.81,0.12,0.0,0.0,"Fiber_g, Sugar_g"
23096,"beef chuck under blade steak bnless ln 0"" fat choic ckd brsd",222.0,30.91,10.91,0.0,0.0,0.0,"Carb_g, Fiber_g, Sugar_g"
23097,"beef chuck under blade steak bnless ln 0"" fat sel ckd brsd",215.0,32.01,9.66,0.0,0.0,0.0,"Carb_g, Fiber_g, Sugar_g"
23098,"beef chuck und bl steak bnls ln 0"" fat all grds ckd brsd",219.0,31.35,10.41,0.0,0.0,0.0,"Carb_g, Fiber_g, Sugar_g"
23099,"beef chk und bld  pot rst bnl ln  fat 0"" fat all gr ckd br",291.0,26.7,20.49,0.0,0.0,0.0,"Carb_g, Fiber_g, Sugar_g"
23100,"beef rib eye stk bnles lip-on ln 18"" fat all grds ckd grld",207.0,27.97,10.57,0.0,0.0,0.0,"Carb_g, Fiber_g, Sugar_g"
23101,"beef rib eye rst bone-in lip-on ln 18"" fat choic ckd rstd",240.0,27.18,14.55,0.0,0.0,0.0,"Carb_g, Fiber_g, Sugar_g"
23102,"beef chk und bl pot rststk bnl ln  ft 0"" ft  all gr  raw",196.0,19.17,13.26,0.0,0.0,0.0,"Carb_g, Fiber_g, Sugar_g"
23103,"beef chk und bl pot rst or stk bnl ln  fat 0"" fat  ch  raw",202.0,19.15,13.93,0.0,0.0,0.0,"Carb_g, Fiber_g, Sugar_g"
23104,"beef chk und bl pot rststeak bnl ln  fat 0"" fat  sel  raw",187.0,19.2,12.27,0.0,0.0,0.0,"Carb_g, Fiber_g, Sugar_g"
23105,beef chk und bl cntr stk bnl den cut ln  fat  all gr  ckd,227.0,26.18,13.54,0.21,0.0,0.0,"Fiber_g, Sugar_g"
23106,"beef chk und ble cntr stk bnl den ct lnft  0"" ft ch ckd gld",236.0,26.1,14.41,0.4,0.0,0.0,"Fiber_g, Sugar_g"
23107,"beef chk undbl cntr stk bnl den ct lnfat  0"" ft sel ckd gld",215.0,26.3,12.25,0.0,0.0,0.0,"Carb_g, Fiber_g, Sugar_g"
23108,"beef chk und bl cntr stk bnl den cut ln  ft 0""ft all gr  rw",182.0,18.99,11.64,0.36,0.0,0.0,"Fiber_g, Sugar_g"
23109,"beef chk undble cntr stk bnl denr cut ln  fat 0""fat  ch  rw",189.0,18.85,12.4,0.53,0.0,0.0,"Fiber_g, Sugar_g"
23110,"beef chk und ble cntr stk bnl den cut ln  ft 0""ft  sel rw",172.0,19.2,10.5,0.09,0.0,0.0,"Fiber_g, Sugar_g"
23111,"beef shldr pot rst or steak bnless ln  fat 0"" fat choic raw",133.0,21.17,5.33,0.07,0.0,0.0,"Fiber_g, Sugar_g"
23112,"beef shldr pot rst or steak bnless ln  fat 0"" fat sel raw",127.0,21.72,4.44,0.0,0.0,0.0,"Carb_g, Fiber_g, Sugar_g"
23113,"beef chk eye rst bnls a bf rst ln  fat 0"" all grd ckd rstd",236.0,24.63,15.29,0.0,0.0,0.0,"Carb_g, Fiber_g, Sugar_g"
23114,"beef chk eye rst bnls a bf rst ln  fat 0"" ch ckd rstd",241.0,24.47,15.87,0.0,0.0,0.0,"Carb_g, Fiber_g, Sugar_g"
23115,"beef chck eye rst bnls a bf rst ln  fat 0"" sel c rstd",229.0,24.86,14.41,0.0,0.0,0.0,"Carb_g, Fiber_g, Sugar_g"
23116,"beef chuck under blade steak bnless ln  fat 0"" fat all grds",275.0,28.23,18.0,0.0,0.0,0.0,"Carb_g, Fiber_g, Sugar_g"
23117,"beef chuck under blade steak bnless ln  fat 0"" fat choic ck",284.0,27.6,19.3,0.0,0.0,0.0,"Carb_g, Fiber_g, Sugar_g"
23118,"beef chuck under blade steak bnless ln  fat 0"" fat sel ckd ",261.0,29.18,16.05,0.0,0.0,0.0,"Carb_g, Fiber_g, Sugar_g"
23119,"beef chk mock tndr stk bnl ln  fat 0"" fat all grds  ckd",220.0,32.07,10.18,0.0,0.0,0.0,"Carb_g, Fiber_g, Sugar_g"
23120,"beef chuck mock tender steak bnless ln  fat 0"" fat choic ck",225.0,32.21,10.74,0.0,0.0,0.0,"Carb_g, Fiber_g, Sugar_g"
23121,"beef chuck mock tender steak bnless ln  fat 0"" fat sel ckd ",211.0,31.86,9.34,0.0,0.0,0.0,"Carb_g, Fiber_g, Sugar_g"
23122,"beef chk mock ten stk bnl ln  fat 0"" fat all grds  ckd",128.0,21.13,4.79,0.0,0.0,0.0,"Carb_g, Fiber_g, Sugar_g"
23123,"beef chk mock tender steak bnless ln  fat 0"" fat choic raw",131.0,21.19,5.18,0.0,0.0,0.0,"Carb_g, Fiber_g, Sugar_g"
23124,"beef chuck mock tender steak bnless ln  fat 0"" fat sel raw",122.0,21.05,4.2,0.0,0.0,0.0,"Carb_g, Fiber_g, Sugar_g"
23125,"beef chuck shrt ribs bnless ln  fat 0"" fat all grds ckd brs",305.0,25.48,22.58,0.0,0.0,0.0,"Carb_g, Fiber_g, Sugar_g"
