NDB_No,Descrip,Energy_kcal,Protein_g,Fat_g,Carb_g,Fiber_g,Sugar_g,zero_in
14159,alcoholic bev wine table red mouvedre,88.0,0.07,0.0,2.64,0.0,0.0,"Fat_g, Fiber_g, Sugar_g"
14160,alcoholic bev wine table white chardonnay,84.0,0.07,0.0,2.16,0.0,0.96,"Fat_g, Fiber_g"
14161,beverages kiwi strawberry juc drk,47.0,0.0,0.0,12.26,0.0,11.63,"Protein_g, Fat_g, Fiber_g"
14162,beverages appl juc drk lt fort w vit c,22.0,0.0,0.1,5.1,0.0,4.8,"Protein_g, Fiber_g"
14164,beverages choc malt pdr prep w 1 milk fort,57.0,3.32,0.97,8.81,0.0,7.81,Fiber_g
14165,beverages carb limeade hi caffeine,18.0,0.0,0.11,4.16,0.0,3.97,"Protein_g, Fiber_g"
14166,bev carb lo cal cola or peper-type w na saccharin  caffeine,0.0,0.0,0.0,0.1,0.0,0.0,"Energy_kcal, Protein_g, Fat_g, Fiber_g, Sugar_g"
14167,beverages powerade zero mxd berry,0.0,0.0,0.0,0.14,0.0,0.0,"Energy_kcal, Protein_g, Fat_g, Fiber_g, Sugar_g"
14168,beverages carob-flavor bev mix pdr,372.0,1.8,0.2,93.3,8.0,0.0,Sugar_g
14169,beverages carob-flavor bev mix pdr prep w whl milk,75.0,3.16,3.11,8.68,0.4,0.0,Sugar_g
14171,beverages cocnt milk swtnd fort w ca vitamins a b12 d2,31.0,0.21,2.08,2.92,0.0,2.5,Fiber_g
14173,beverages coffee ready to drk vanilla lt milk bsd swtnd,36.0,2.14,1.07,4.27,0.0,3.91,Fiber_g
14174,beve lemonade fruit juc drk lt fort w vit e  c,21.0,0.0,0.0,5.0,0.0,5.0,"Protein_g, Fat_g, Fiber_g"
14177,beverages chocolate-flavor bev mix pdr prep w whl milk,85.0,3.23,3.24,11.91,0.4,0.0,Sugar_g
14179,beverages coffee ready to drk milk bsd swtnd,71.0,1.98,1.38,12.6,0.0,10.67,Fiber_g
14180,beverages coffee brewed brkfst blend,2.0,0.3,0.0,0.23,0.0,0.0,"Fat_g, Fiber_g, Sugar_g"
14183,beverages coffee ready to drk iced mocha milk bsd,60.0,1.48,0.98,11.42,0.0,9.23,Fiber_g
14185,beverages tea oolong brewed,1.0,0.0,0.0,0.15,0.0,0.0,"Protein_g, Fat_g, Fiber_g, Sugar_g"
14188,beverages tea grn ready to drk ginseng  honey swtnd,30.0,0.0,0.18,7.16,0.0,6.87,"Protein_g, Fiber_g"
14189,beverages the coca-cola company minute maid lemonade,46.0,0.0,0.0,12.08,0.0,11.67,"Protein_g, Fat_g, Fiber_g"
14190,beverages tea grn rtd diet,0.0,0.0,0.0,0.0,0.0,0.93,"Energy_kcal, Protein_g, Fat_g, Carb_g, Fiber_g"
14191,beverages tea grn rtd citrus diet fort w vit c,1.0,0.0,0.0,0.31,0.0,0.0,"Protein_g, Fat_g, Fiber_g, Sugar_g"
14199,beverages tea black rtd lemon swtnd,45.0,0.0,0.22,10.8,0.0,9.49,"Protein_g, Fiber_g"
14201,beverages coffee brewed prep w tap h2o decaffeinated,0.0,0.1,0.0,0.0,0.0,0.0,"Energy_kcal, Fat_g, Carb_g, Fiber_g, Sugar_g"
14202,beverages coffee brewed espresso rest-prep decaffeinated,9.0,0.1,0.18,1.69,0.0,0.0,"Fiber_g, Sugar_g"
14203,beverages coffee inst reg half the caffeine,352.0,14.42,0.5,73.18,0.0,0.0,"Fiber_g, Sugar_g"
14206,beverages tea grn rtd swtnd,27.0,0.0,0.22,6.2,0.0,5.32,"Protein_g, Fiber_g"
14207,beverages tea rtd lemon diet,2.0,0.0,0.0,0.41,0.0,0.0,"Protein_g, Fat_g, Fiber_g, Sugar_g"
14209,beverages coffee brewed prep w tap h2o,1.0,0.12,0.02,0.0,0.0,0.0,"Carb_g, Fiber_g, Sugar_g"
14210,beverages coffee brewed espresso rest-prep,9.0,0.12,0.18,1.67,0.0,0.0,"Fiber_g, Sugar_g"
14211,beverages tea black rtd lemon diet,1.0,0.0,0.0,0.22,0.0,0.0,"Protein_g, Fat_g, Fiber_g, Sugar_g"
14214,beverages coffee inst reg pdr,353.0,12.2,0.5,75.4,0.0,0.0,"Fiber_g, Sugar_g"
14215,beverages coffee inst reg prep w h2o,2.0,0.1,0.0,0.34,0.0,0.0,"Fat_g, Fiber_g, Sugar_g"
14216,beverages aloe vera juc drk fort w vit c,15.0,0.0,0.0,3.75,0.0,3.75,"Protein_g, Fat_g, Fiber_g"
14217,beverages ocean spray cran grape,54.0,0.21,0.0,13.16,0.6,12.6,Fat_g
14218,beverages coffee inst decaffeinated pdr,351.0,11.6,0.2,76.0,0.0,0.0,"Fiber_g, Sugar_g"
14219,beverages coffee inst decaffeinated prep w h2o,2.0,0.12,0.0,0.43,0.0,0.0,"Fat_g, Fiber_g, Sugar_g"
14220,beverages  ocean spray  cranberry-apple juice drink  bottled,56.0,0.29,0.0,13.68,0.6,13.12,Fat_g
14221,beverages ocean spray diet cranberry juc,4.0,0.07,0.0,0.8,0.6,0.25,Fat_g
14222,beverages coffee inst w chicory,355.0,9.3,0.2,78.9,0.5,0.0,Sugar_g
14223,beverages coffee inst chicory,3.0,0.09,0.0,0.75,0.0,0.0,"Fat_g, Fiber_g, Sugar_g"
14226,beverages ocean spray lt cranberry  raspberry flav juc,26.0,0.73,0.0,5.77,0.7,5.02,Fat_g
14233,beverages  ocean spray  cran raspberry juice drink,49.0,0.28,0.0,11.96,0.6,11.4,Fat_g
14234,beverages ocean spray cran lemonade,45.0,0.07,0.0,11.12,0.6,10.4,Fat_g
14235,bev  ocean spray  cran cherry diet,4.0,0.21,0.0,0.7,0.6,0.22,Fat_g
14238,beverages cranberry-apple juc drk btld,63.0,0.0,0.11,15.85,0.0,14.5,"Protein_g, Fiber_g"
14239,alcoholic bev malt beer hard lemonade,68.0,0.0,0.0,10.07,0.0,9.77,"Protein_g, Fat_g, Fiber_g"
14240,beverages cranberry-apricot juc drk btld,64.0,0.2,0.0,16.2,0.1,0.0,"Fat_g, Sugar_g"
14241,beverages cranberry-grape juc drk btld,56.0,0.2,0.1,14.0,0.1,0.0,Sugar_g
14242,cranberry juc cocktail btld,54.0,0.0,0.1,13.52,0.0,11.87,"Protein_g, Fiber_g"
14243,cranberry juc cocktail btld lo cal wca saccharincorn swtnr,19.0,0.02,0.01,4.6,0.0,4.59,Fiber_g
14245,beverages eggnog-flavor mix pdr prep w whl milk,95.0,2.93,3.02,14.2,0.0,12.66,Fiber_g
14246,beverages tea grn inst decaffei lemon unswtnd fort w vit c,378.0,0.0,0.0,94.45,0.0,0.0,"Protein_g, Fat_g, Fiber_g, Sugar_g"
14247,beverages tea black ready to drk,0.0,0.0,0.0,0.0,0.0,0.0,"Energy_kcal, Protein_g, Fat_g, Carb_g, Fiber_g, Sugar_g"
14248,alcoholic bev beer lt higher alcohol,46.0,0.25,0.0,0.77,0.0,0.09,"Fat_g, Fiber_g"
14250,beverages amber hard cider,56.0,0.0,0.0,5.92,0.0,5.92,"Protein_g, Fat_g, Fiber_g"
14251,alcoholic beverages beer higher alcohol,58.0,0.9,0.0,0.27,0.0,0.0,"Fat_g, Fiber_g, Sugar_g"
14252,beverages malt liquor bev,40.0,0.35,0.0,0.0,0.0,0.0,"Fat_g, Carb_g, Fiber_g, Sugar_g"
14253,alcoholic beverages wine rose,83.0,0.36,0.0,3.8,0.0,3.8,"Fat_g, Fiber_g"
14256,beverages ocean spray cran cherry,46.0,0.19,0.0,12.76,0.6,12.2,Fat_g
14260,beverages tea grn brewed decaffeinated,0.0,0.0,0.0,0.0,0.0,0.0,"Energy_kcal, Protein_g, Fat_g, Carb_g, Fiber_g, Sugar_g"
14261,beverages tea grn ready to drk unswtnd,0.0,0.0,0.0,0.0,0.0,0.0,"Energy_kcal, Protein_g, Fat_g, Carb_g, Fiber_g, Sugar_g"
14264,beverages fruit punch drk wo added nutr cnd,48.0,0.0,0.0,11.97,0.0,11.29,"Protein_g, Fat_g, Fiber_g"
14267,beverages fruit punch drk w added nutr cnd,47.0,0.0,0.0,11.94,0.2,11.29,"Protein_g, Fat_g"
14268,beverages fruit punch drk frz conc,162.0,0.2,0.0,41.4,0.4,0.0,"Fat_g, Sugar_g"
14269,beverages fruit punch drk frz conc prep w h2o,46.0,0.06,0.0,11.66,0.1,0.0,"Fat_g, Sugar_g"
14270,beverages coffee inst vanila swtnd decaff w non dairy cream,465.0,0.0,13.33,86.28,0.0,66.67,"Protein_g, Fiber_g"
14276,beverages tropical punch rtd,10.0,0.0,0.0,2.5,0.0,2.5,"Protein_g, Fat_g, Fiber_g"
14277,beverages grape drk cnd,61.0,0.0,0.0,15.72,0.0,13.06,"Protein_g, Fat_g, Fiber_g"
14278,beverages tea grn brewed reg,1.0,0.22,0.0,0.0,0.0,0.0,"Fat_g, Carb_g, Fiber_g, Sugar_g"
14279,beverages tea black rtd peach diet,1.0,0.0,0.0,0.25,0.0,0.0,"Protein_g, Fat_g, Fiber_g, Sugar_g"
14280,beverages tea black ready to drk decaffeinated diet,0.0,0.0,0.0,0.83,0.0,0.0,"Energy_kcal, Protein_g, Fat_g, Fiber_g, Sugar_g"
14281,beverages tea black ready to drk decaffeinated,38.0,0.0,0.0,8.75,0.0,7.92,"Protein_g, Fat_g, Fiber_g"
14282,beverages grape juc drk cnd,57.0,0.0,0.0,14.55,0.1,14.11,"Protein_g, Fat_g"
14284,beverages cranberry juc cocktail,52.0,0.0,0.34,12.25,0.0,11.41,"Protein_g, Fiber_g"
14286,beverages motts appl juc lt fort w vit c,22.0,0.0,0.1,5.1,0.0,4.8,"Protein_g, Fiber_g"
14287,beverages lemonade pdr,376.0,0.0,1.05,97.57,0.4,94.7,Protein_g
14288,lemonade pdr prep wh2o,14.0,0.0,0.04,3.59,0.0,3.5,"Protein_g, Fiber_g"
14291,beverages snapple tea black  grn ready to drk peach diet,2.0,0.1,0.0,0.1,0.0,0.0,"Fat_g, Fiber_g, Sugar_g"
14293,lemonade frz conc white prep wh2o,40.0,0.07,0.04,10.42,0.0,9.98,Fiber_g
14294,beverages snapple tea black  grn ready to drk lemon diet,2.0,0.1,0.0,0.1,0.0,0.0,"Fat_g, Fiber_g, Sugar_g"
14296,beverages lemonade-flavor drk pdr,380.0,0.0,1.01,97.9,0.0,97.15,"Protein_g, Fiber_g"
14297,beverages lemonade-flavor drk pdr prep w h2o,27.0,0.0,0.07,6.9,0.0,6.87,"Protein_g, Fiber_g"
14303,limeade frz conc prep wh2o,52.0,0.0,0.0,13.79,0.0,13.27,"Protein_g, Fat_g, Fiber_g"
14305,malt bev incl non-alcoholic beer,37.0,0.21,0.12,8.05,0.0,8.05,Fiber_g
14309,beverages ovaltine classic malt pdr,372.0,0.0,0.0,93.33,0.0,63.64,"Protein_g, Fat_g, Fiber_g"
14310,bevera malted drk mix nat w add nutr pdr prep w whl milk,86.0,3.67,3.21,10.67,0.0,8.37,Fiber_g
14315,beverages ovaltine choc malt pdr,372.0,0.0,0.0,92.96,0.0,72.73,"Protein_g, Fat_g, Fiber_g"
14323,beverages orange drk cnd w added vit c,49.0,0.0,0.07,12.34,0.0,11.03,"Protein_g, Fiber_g"
14341,beverages pnappl  orange juc drk cnd,50.0,1.3,0.0,11.8,0.1,11.59,Fat_g
14350,strawberry-flavor bev mix pdr,389.0,0.1,0.2,99.1,0.0,95.45,Fiber_g
14351,beverages strawberry-flavor bev mix pdr prep w whl milk,88.0,3.0,3.1,12.3,0.0,0.0,"Fiber_g, Sugar_g"
14352,beverages tea black brewed prep w tap h2o decaffeinated,1.0,0.0,0.0,0.3,0.0,0.0,"Protein_g, Fat_g, Fiber_g, Sugar_g"
14353,beverages tea inst decaffeinated unswtnd,315.0,20.21,0.0,58.66,8.5,5.53,Fat_g
14355,beverages tea black brewed prep w tap h2o,1.0,0.0,0.0,0.3,0.0,0.0,"Protein_g, Fat_g, Fiber_g, Sugar_g"
14356,beverages tea inst decaffeinated lemon diet,338.0,3.3,0.6,85.4,0.0,1.88,Fiber_g
14357,beverages tea inst decaffeinated lemon swtnd,401.0,0.12,0.73,98.55,0.0,95.29,Fiber_g
14366,beverages tea inst unswtnd pdr,315.0,20.21,0.0,58.66,8.5,5.53,Fat_g
14367,beverages tea inst unswtnd prep w h2o,1.0,0.06,0.0,0.17,0.0,0.02,"Fat_g, Fiber_g"
14375,beverages tea inst swtnd w na saccharin lemon-flavored pdr,338.0,3.3,0.6,85.4,0.0,1.88,Fiber_g
14376,beverages tea inst lemon diet,2.0,0.02,0.0,0.44,0.0,0.01,"Fat_g, Fiber_g"
14381,beverages tea herb other than chamomile brewed,1.0,0.0,0.0,0.2,0.0,0.0,"Protein_g, Fat_g, Fiber_g, Sugar_g"
14384,beverages h2o btld perrier,0.0,0.0,0.0,0.0,0.0,0.0,"Energy_kcal, Protein_g, Fat_g, Carb_g, Fiber_g, Sugar_g"
14385,beverages h2o btld poland spring,0.0,0.0,0.0,0.0,0.0,0.0,"Energy_kcal, Protein_g, Fat_g, Carb_g, Fiber_g, Sugar_g"
14400,beverages carb cola fast-food cola,37.0,0.07,0.02,9.56,0.0,8.97,Fiber_g
14405,beverages fruit punch juc drk frz conc,175.0,0.3,0.7,43.1,0.2,0.0,Sugar_g
14406,beverages fruit punch juc drk frz conc prep w h2o,42.0,0.07,0.17,11.4,0.0,11.4,Fiber_g
14407,beverages orange-flavor drk brkfst type pdr,386.0,0.0,0.0,98.94,0.4,92.31,"Protein_g, Fat_g"
14408,beverages orange-flavor drk brkfst type pdr prep w h2o,49.0,0.0,0.0,12.65,0.1,11.8,"Protein_g, Fat_g"
14409,beverages orange-flavor drk brkfst type lo cal pdr,217.0,3.6,0.0,85.9,3.8,2.6,Fat_g
14411,beverages h2o tap drinking,0.0,0.0,0.0,0.0,0.0,0.0,"Energy_kcal, Protein_g, Fat_g, Carb_g, Fiber_g, Sugar_g"
14412,beverages h2o tap well,0.0,0.0,0.0,0.0,0.0,0.0,"Energy_kcal, Protein_g, Fat_g, Carb_g, Fiber_g, Sugar_g"
14414,alcoholic bev liqueur coffee 53 proof,336.0,0.1,0.3,46.8,0.0,38.3,Fiber_g
14415,alcoholic bev liqueur coffee w crm 34 proof,327.0,2.8,15.7,20.9,0.0,19.76,Fiber_g
14416,beverages carb lo cal cola or pepper-type w asprt  caffeine,2.0,0.11,0.03,0.29,0.0,0.0,"Fiber_g, Sugar_g"
14421,beverages coffee sub crl grain bev pdr prep w whl milk,65.0,3.3,3.3,5.6,0.1,0.0,Sugar_g
14425,beve orange-flav drk brkfst type w pulp frz conc pre w h2o,49.0,0.03,0.14,12.21,0.0,11.91,Fiber_g
14426,beverages orange drk brkfst type w juc  pulp frz conc,153.0,0.4,0.0,39.0,0.1,38.05,Fat_g
14427,bev orange drk brkfst type w juc  pulp frz conc pre w h2o,45.0,0.12,0.0,11.32,0.0,11.05,"Fat_g, Fiber_g"
14428,beverages shake fast fd strawberry,113.0,3.4,2.8,18.9,0.4,0.0,Sugar_g
14429,beverages h2o tap municipal,0.0,0.0,0.0,0.0,0.0,0.0,"Energy_kcal, Protein_g, Fat_g, Carb_g, Fiber_g, Sugar_g"
14430,cranberry juc cocktail frz conc,201.0,0.05,0.0,51.45,0.2,42.5,Fat_g
14431,cranberry juc cocktail frz conc prep w h2o,47.0,0.01,0.0,11.81,0.0,9.76,"Fat_g, Fiber_g"
14432,beverages h2o btld non-carbonated dannon,0.0,0.0,0.0,0.0,0.0,0.0,"Energy_kcal, Protein_g, Fat_g, Carb_g, Fiber_g, Sugar_g"
14433,beverages h2o btld non-carbonated pepsi aquafina,0.0,0.0,0.0,0.0,0.0,0.0,"Energy_kcal, Protein_g, Fat_g, Carb_g, Fiber_g, Sugar_g"
14434,beverages the coca-cola comp dasani h2o btld non-carbonated,0.0,0.0,0.0,0.0,0.0,0.0,"Energy_kcal, Protein_g, Fat_g, Carb_g, Fiber_g, Sugar_g"
14436,beverages orange brkfst drk rtd w added nutr,53.0,0.0,0.0,13.2,0.1,8.02,"Protein_g, Fat_g"
14437,beverages h2o btld non-carbonated calistoga,0.0,0.0,0.0,0.0,0.0,0.0,"Energy_kcal, Protein_g, Fat_g, Carb_g, Fiber_g, Sugar_g"
14438,beverages h2o btld non-carbonated crystal geyser,0.0,0.0,0.0,0.0,0.0,0.0,"Energy_kcal, Protein_g, Fat_g, Carb_g, Fiber_g, Sugar_g"
14439,water btld non-carbonated naya,0.0,0.0,0.0,0.0,0.0,0.0,"Energy_kcal, Protein_g, Fat_g, Carb_g, Fiber_g, Sugar_g"
14440,beverages h2o btld non-carbonated dannon fluoride to go,0.0,0.0,0.0,0.03,0.0,0.0,"Energy_kcal, Protein_g, Fat_g, Fiber_g, Sugar_g"
14450,beverages drk mix quaker oats gatorade orange flavor pdr,388.0,0.0,1.23,94.11,0.0,80.5,"Protein_g, Fiber_g"
14460,beverages pepsico quaker gatorade g performance o 2 rtd,26.0,0.0,0.0,6.43,0.0,5.24,"Protein_g, Fat_g, Fiber_g"
14461,beverages coca-cola powerade lemon-lime flav rtd,32.0,0.0,0.05,7.84,0.0,6.11,"Protein_g, Fiber_g"
14462,beverages propel zero fruit-flavored non-carbonated,5.0,0.0,0.0,1.14,0.0,0.0,"Protein_g, Fat_g, Fiber_g, Sugar_g"
14475,beverages arizona tea rtd lemon,39.0,0.0,0.0,9.77,0.0,9.63,"Protein_g, Fat_g, Fiber_g"
14476,beverages lipton brisk tea black rtd lemon,35.0,0.0,0.0,8.81,0.0,8.69,"Protein_g, Fat_g, Fiber_g"
14530,whiskey sour mix btld w kna,84.0,0.1,0.1,21.4,0.0,0.0,"Fiber_g, Sugar_g"
14531,alcoholic bev whiskey sour,149.0,0.0,0.03,13.17,0.0,0.0,"Protein_g, Fiber_g, Sugar_g"
14532,alcoholic bev distilled all (gin rum vodka whiskey) 94 proof,275.0,0.0,0.0,0.0,0.0,0.0,"Protein_g, Fat_g, Carb_g, Fiber_g, Sugar_g"
14533,alcoholic bev distilled all (gin rum vodka whiskey) 100proof,295.0,0.0,0.0,0.0,0.0,0.0,"Protein_g, Fat_g, Carb_g, Fiber_g, Sugar_g"
14534,alcoholic bev liqueur coffee 63 proof,308.0,0.1,0.3,32.2,0.0,32.2,Fiber_g
14536,alcoholic bev wine dssrt dry,152.0,0.2,0.0,11.67,0.0,1.09,"Fat_g, Fiber_g"
14537,carbonated bev local othr than cola or pep w na sac wo caf,0.0,0.0,0.0,0.1,0.0,0.0,"Energy_kcal, Protein_g, Fat_g, Fiber_g, Sugar_g"
14541,beverage fruit punch-flavor drk pdr wo added na prep w h2o,37.0,0.0,0.01,9.47,0.0,9.23,"Protein_g, Fiber_g"
14544,beverages tea black brewed prep w distilled h2o,1.0,0.0,0.0,0.3,0.0,0.0,"Protein_g, Fat_g, Fiber_g, Sugar_g"
14545,beverages tea herb brewed chamomile,1.0,0.0,0.0,0.2,0.0,0.0,"Protein_g, Fat_g, Fiber_g, Sugar_g"
14548,beverages tea inst lemon w added vit c,385.0,0.6,0.3,97.6,0.0,0.0,"Fiber_g, Sugar_g"
14550,alcoholic bev distilled all (gin rum vodka whiskey) 86 proof,250.0,0.0,0.0,0.1,0.0,0.0,"Protein_g, Fat_g, Fiber_g, Sugar_g"
14551,alcoholic bev distilled all (gin rum vodka whiskey) 90 proof,263.0,0.0,0.0,0.0,0.0,0.0,"Protein_g, Fat_g, Carb_g, Fiber_g, Sugar_g"
14552,carbonated bev chocolate-flavored soda,42.0,0.0,0.0,10.7,0.0,10.7,"Protein_g, Fat_g, Fiber_g"
14553,beverages wine non-alcoholic,6.0,0.5,0.0,1.1,0.0,1.1,"Fat_g, Fiber_g"
14555,water btld generic,0.0,0.0,0.0,0.0,0.0,0.0,"Energy_kcal, Protein_g, Fat_g, Carb_g, Fiber_g, Sugar_g"
14559,beverages h2o btld non-carbonated evian,0.0,0.0,0.0,0.0,0.0,0.0,"Energy_kcal, Protein_g, Fat_g, Carb_g, Fiber_g, Sugar_g"
14599,beverages powerade zero ion4 calorie-free assorted flavors,0.0,0.0,0.0,0.0,0.0,0.0,"Energy_kcal, Protein_g, Fat_g, Carb_g, Fiber_g, Sugar_g"
14601,beverages wendy's tea rtd unswtnd,1.0,0.22,0.0,0.0,0.0,0.0,"Fat_g, Carb_g, Fiber_g, Sugar_g"
14602,alcoholic bev wine table red merlot,83.0,0.07,0.0,2.51,0.0,0.62,"Fat_g, Fiber_g"
14604,water non-carbonated fruit flavors swtnd w lo cal swtnr,1.0,0.0,0.0,0.13,0.0,0.0,"Protein_g, Fat_g, Fiber_g, Sugar_g"
14605,bev h2o w added vit  min bottles swtnd ast fruit flavors,22.0,0.0,0.0,5.49,0.0,5.49,"Protein_g, Fat_g, Fiber_g"
14607,beverages v8 splash juc drinks diet berry blend,4.0,0.0,0.0,1.23,0.0,0.41,"Protein_g, Fat_g, Fiber_g"
14608,beverages v8 splash juc drinks diet fruit medley,4.0,0.0,0.0,1.26,0.0,0.84,"Protein_g, Fat_g, Fiber_g"
14609,beverages v8 splash juc drinks diet strawberry kiwi,4.0,0.0,0.0,1.26,0.0,0.84,"Protein_g, Fat_g, Fiber_g"
14610,beverages v8 splash juc drinks diet tropical blend,4.0,0.0,0.0,1.26,0.0,0.42,"Protein_g, Fat_g, Fiber_g"
14611,beverages v8 splash juc drinks berry blend,29.0,0.0,0.0,7.41,0.0,7.41,"Protein_g, Fat_g, Fiber_g"
14612,beverages v8 splash juc drinks fruit medley,33.0,0.0,0.0,7.82,0.0,7.82,"Protein_g, Fat_g, Fiber_g"
14613,beverages v8 splash juc drinks guava passion fruit,33.0,0.0,0.0,7.82,0.0,7.82,"Protein_g, Fat_g, Fiber_g"
14614,beverages v8 splash juc drinks mango peach,33.0,0.0,0.0,8.23,0.0,8.23,"Protein_g, Fat_g, Fiber_g"
14615,beverages v8 splash juc drinks orange pnappl,29.0,0.0,0.0,7.41,0.0,7.41,"Protein_g, Fat_g, Fiber_g"
14616,beverages v8 splash juc drinks orchard blend,33.0,0.0,0.0,7.82,0.0,7.82,"Protein_g, Fat_g, Fiber_g"
14617,beverages v8 splash juc drinks strawberry banana,29.0,0.0,0.0,7.41,0.0,7.41,"Protein_g, Fat_g, Fiber_g"
14618,beverages v8 splash juc drinks strawberry kiwi,29.0,0.0,0.0,7.41,0.0,7.41,"Protein_g, Fat_g, Fiber_g"
14619,beverages v8 splash juc drinks tropical blend,29.0,0.0,0.0,7.41,0.0,7.41,"Protein_g, Fat_g, Fiber_g"
14620,beverages v8 v-fusion juices peach mango,49.0,0.41,0.0,11.38,0.0,10.57,"Fat_g, Fiber_g"
14621,beverages v8 v-fusion juices strawberry banana,49.0,0.41,0.0,11.79,0.0,10.16,"Fat_g, Fiber_g"
14622,beverages v8 v-fusion juices tropical,49.0,0.41,0.0,11.38,0.0,10.16,"Fat_g, Fiber_g"
14623,beverages v8 v- fusion juices acai berry,45.0,0.0,0.0,10.98,0.0,10.57,"Protein_g, Fat_g, Fiber_g"
14625,beverages energy drk amp,46.0,0.25,0.08,12.08,0.0,12.08,Fiber_g
14626,beverages energy drk full throttle,46.0,0.25,0.08,12.08,0.0,12.08,Fiber_g
14627,beverages energy drk monster fort w vitamins c b2 b3 b6 b12,47.0,0.47,0.0,11.28,0.0,10.93,"Fat_g, Fiber_g"
14628,beverages energy drk amp sugar free,2.0,0.0,0.0,1.03,0.0,0.0,"Protein_g, Fat_g, Fiber_g, Sugar_g"
14629,beverages energy drk rockstar,58.0,0.34,0.22,12.7,0.0,12.26,Fiber_g
14630,beverages energy drk rockstar sugar free,4.0,0.25,0.08,0.7,0.0,0.0,"Fiber_g, Sugar_g"
14632,beverages meal supp drk cnd pnut flavor,101.0,3.5,3.07,14.74,0.0,0.0,"Fiber_g, Sugar_g"
14633,bever veg  fruit juc drk red cal w low-cal swtnr add vit c,4.0,0.0,0.0,1.1,0.0,0.63,"Protein_g, Fat_g, Fiber_g"
14635,beverages veg  fruit juc blend w added vitamins a c e,46.0,0.3,0.01,11.15,0.0,10.37,Fiber_g
14636,beverages fruit juc drk red sugar w vitamin e added,39.0,0.0,0.07,10.0,0.0,9.0,"Protein_g, Fiber_g"
14637,water w corn syrup andor sugar  lo cal swtnr fruit flav,18.0,0.0,0.0,4.5,0.0,4.5,"Protein_g, Fat_g, Fiber_g"
14638,beverages horchata as served in restaurant,54.0,0.48,0.71,11.52,0.0,9.36,Fiber_g
14640,beverages energy drk vault citrus flavor,49.0,0.0,0.0,12.99,0.0,12.99,"Protein_g, Fat_g, Fiber_g"
14641,beverages energy drk vault zero sugar-free citrus flavor,1.0,0.25,0.08,0.7,0.0,0.0,"Fiber_g, Sugar_g"
14644,beverages pepsico quaker gatorade g2 lo cal,8.0,0.05,0.01,1.94,0.0,1.3,Fiber_g
14645,beverages fruit flav drk less than 3 juc not fort w vit c,64.0,0.0,0.0,16.03,0.0,15.85,"Protein_g, Fat_g, Fiber_g"
14646,bev fruit flav drk containing   3 fruit juc w hi vit c,27.0,0.0,0.0,6.67,0.0,5.0,"Protein_g, Fat_g, Fiber_g"
14647,bev fruit flav drk red sugar   3 fruit juc hi vit c add ca,29.0,0.0,0.37,6.67,0.0,5.0,"Protein_g, Fiber_g"
14648,bev fruit juc drk  more  3 fruit juc hi vit c  add thiamin,54.0,0.13,0.0,13.16,0.1,12.11,Fat_g
14649,beverages tea hibiscus brewed,0.0,0.0,0.0,0.0,0.0,0.0,"Energy_kcal, Protein_g, Fat_g, Carb_g, Fiber_g, Sugar_g"
14654,beverages nutritional shake mix hi prot pdr,392.0,53.57,10.71,20.38,0.0,3.57,Fiber_g
15001,anchovy european raw,131.0,20.35,4.84,0.0,0.0,0.0,"Carb_g, Fiber_g, Sugar_g"
15002,anchovy european cnd in oil drnd sol,210.0,28.89,9.71,0.0,0.0,0.0,"Carb_g, Fiber_g, Sugar_g"
15003,bass frsh h2o mxd sp raw,114.0,18.86,3.69,0.0,0.0,0.0,"Carb_g, Fiber_g, Sugar_g"
15004,bass striped raw,97.0,17.73,2.33,0.0,0.0,0.0,"Carb_g, Fiber_g, Sugar_g"
15005,bluefish raw,124.0,20.04,4.24,0.0,0.0,0.0,"Carb_g, Fiber_g, Sugar_g"
15006,burbot raw,90.0,19.31,0.81,0.0,0.0,0.0,"Carb_g, Fiber_g, Sugar_g"
15007,butterfish raw,146.0,17.28,8.02,0.0,0.0,0.0,"Carb_g, Fiber_g, Sugar_g"
15008,carp raw,127.0,17.83,5.6,0.0,0.0,0.0,"Carb_g, Fiber_g, Sugar_g"
15009,carp cooked dry heat,162.0,22.86,7.17,0.0,0.0,0.0,"Carb_g, Fiber_g, Sugar_g"
15010,catfish channel wild raw,95.0,16.38,2.82,0.0,0.0,0.0,"Carb_g, Fiber_g, Sugar_g"
15011,catfish channel ckd breadedfried,229.0,18.09,13.33,8.04,0.7,0.0,Sugar_g
15012,caviar blackred granular,264.0,24.6,17.9,4.0,0.0,0.0,"Fiber_g, Sugar_g"
15013,cisco raw,98.0,18.99,1.91,0.0,0.0,0.0,"Carb_g, Fiber_g, Sugar_g"
15014,cisco smoked,177.0,16.36,11.9,0.0,0.0,0.0,"Carb_g, Fiber_g, Sugar_g"
15015,cod atlantic raw,82.0,17.81,0.67,0.0,0.0,0.0,"Carb_g, Fiber_g, Sugar_g"
15016,cod atlantic ckd dry heat,105.0,22.83,0.86,0.0,0.0,0.0,"Carb_g, Fiber_g, Sugar_g"
15017,cod atlantic cnd solliq,105.0,22.76,0.86,0.0,0.0,0.0,"Carb_g, Fiber_g, Sugar_g"
15018,cod atlantic driedsalted,290.0,62.82,2.37,0.0,0.0,0.0,"Carb_g, Fiber_g, Sugar_g"
15019,fish cod pacific raw (may have been previously frozen),69.0,15.27,0.41,0.0,0.0,0.0,"Carb_g, Fiber_g, Sugar_g"
15020,croaker atlantic raw,104.0,17.78,3.17,0.0,0.0,0.0,"Carb_g, Fiber_g, Sugar_g"
15021,croaker atlantic ckd breadedfried,221.0,18.2,12.67,7.54,0.4,0.0,Sugar_g
15022,cusk raw,87.0,18.99,0.69,0.0,0.0,0.0,"Carb_g, Fiber_g, Sugar_g"
15023,fish mahimahi raw,85.0,18.5,0.7,0.0,0.0,0.0,"Carb_g, Fiber_g, Sugar_g"
15024,drum freshwater raw,119.0,17.54,4.93,0.0,0.0,0.0,"Carb_g, Fiber_g, Sugar_g"
15025,eel mixed species raw,184.0,18.44,11.66,0.0,0.0,0.0,"Carb_g, Fiber_g, Sugar_g"
15026,eel mxd sp ckd dry heat,236.0,23.65,14.95,0.0,0.0,0.0,"Carb_g, Fiber_g, Sugar_g"
15028,flatfish (floundersole sp) raw,70.0,12.41,1.93,0.0,0.0,0.0,"Carb_g, Fiber_g, Sugar_g"
15029,flatfish (floundersole sp) ckd dry heat,86.0,15.24,2.37,0.0,0.0,0.0,"Carb_g, Fiber_g, Sugar_g"
15030,gefiltefish comm swt recipe,84.0,9.07,1.73,7.41,0.0,0.0,"Fiber_g, Sugar_g"
15031,grouper mixed species raw,92.0,19.38,1.02,0.0,0.0,0.0,"Carb_g, Fiber_g, Sugar_g"
15032,grouper mxd sp ckd dry heat,118.0,24.84,1.3,0.0,0.0,0.0,"Carb_g, Fiber_g, Sugar_g"
15033,haddock raw,74.0,16.32,0.45,0.0,0.0,0.0,"Carb_g, Fiber_g, Sugar_g"
15034,haddock cooked dry heat,90.0,19.99,0.55,0.0,0.0,0.0,"Carb_g, Fiber_g, Sugar_g"
15035,haddock smoked,116.0,25.23,0.96,0.0,0.0,0.0,"Carb_g, Fiber_g, Sugar_g"
15036,halibut atlanticpacific raw,91.0,18.56,1.33,0.0,0.0,0.0,"Carb_g, Fiber_g, Sugar_g"
15037,halibut atlanticpacific ckd dry heat,111.0,22.54,1.61,0.0,0.0,0.0,"Carb_g, Fiber_g, Sugar_g"
15038,halibut greenland raw,186.0,14.37,13.84,0.0,0.0,0.0,"Carb_g, Fiber_g, Sugar_g"
15039,herring atlantic raw,158.0,17.96,9.04,0.0,0.0,0.0,"Carb_g, Fiber_g, Sugar_g"
15040,herring atlantic ckd dry heat,203.0,23.03,11.59,0.0,0.0,0.0,"Carb_g, Fiber_g, Sugar_g"
15041,herring atlantic pickled,262.0,14.19,18.0,9.64,0.0,7.71,Fiber_g
15042,herring atlantic kippered,217.0,24.58,12.37,0.0,0.0,0.0,"Carb_g, Fiber_g, Sugar_g"
15043,herring pacific raw,195.0,16.39,13.88,0.0,0.0,0.0,"Carb_g, Fiber_g, Sugar_g"
15044,ling raw,87.0,18.99,0.64,0.0,0.0,0.0,"Carb_g, Fiber_g, Sugar_g"
15045,lingcod raw,85.0,17.66,1.06,0.0,0.0,0.0,"Carb_g, Fiber_g, Sugar_g"
15046,mackerel atlantic raw,205.0,18.6,13.89,0.0,0.0,0.0,"Carb_g, Fiber_g, Sugar_g"
15047,mackerel atlantic ckd dry heat,262.0,23.85,17.81,0.0,0.0,0.0,"Carb_g, Fiber_g, Sugar_g"
15048,mackerel jack cnd drnd sol,156.0,23.19,6.3,0.0,0.0,0.0,"Carb_g, Fiber_g, Sugar_g"
15049,mackerel king raw,105.0,20.28,2.0,0.0,0.0,0.0,"Carb_g, Fiber_g, Sugar_g"
15050,mackerel pacificjack mxd sp raw,158.0,20.07,7.89,0.0,0.0,0.0,"Carb_g, Fiber_g, Sugar_g"
15051,mackerel spanish raw,139.0,19.29,6.3,0.0,0.0,0.0,"Carb_g, Fiber_g, Sugar_g"
15052,mackerel spanish ckd dry heat,158.0,23.59,6.32,0.0,0.0,0.0,"Carb_g, Fiber_g, Sugar_g"
15053,milkfish raw,148.0,20.53,6.73,0.0,0.0,0.0,"Carb_g, Fiber_g, Sugar_g"
15054,monkfish raw,76.0,14.48,1.52,0.0,0.0,0.0,"Carb_g, Fiber_g, Sugar_g"
15055,mullet striped raw,117.0,19.35,3.79,0.0,0.0,0.0,"Carb_g, Fiber_g, Sugar_g"
15056,mullet striped ckd dry heat,150.0,24.81,4.86,0.0,0.0,0.0,"Carb_g, Fiber_g, Sugar_g"
15057,ocean perch atlantic raw,79.0,15.31,1.54,0.0,0.0,0.0,"Carb_g, Fiber_g, Sugar_g"
15058,ocean perch atlantic ckd dry heat,96.0,18.51,1.87,0.0,0.0,0.0,"Carb_g, Fiber_g, Sugar_g"
15059,pout ocean raw,79.0,16.64,0.91,0.0,0.0,0.0,"Carb_g, Fiber_g, Sugar_g"
15060,perch mixed species raw,91.0,19.39,0.92,0.0,0.0,0.0,"Carb_g, Fiber_g, Sugar_g"
15061,perch mxd sp ckd dry heat,117.0,24.86,1.18,0.0,0.0,0.0,"Carb_g, Fiber_g, Sugar_g"
15062,pike northern raw,88.0,19.26,0.69,0.0,0.0,0.0,"Carb_g, Fiber_g, Sugar_g"
15063,pike northern ckd dry heat,113.0,24.69,0.88,0.0,0.0,0.0,"Carb_g, Fiber_g, Sugar_g"
15064,pike walleye raw,93.0,19.14,1.22,0.0,0.0,0.0,"Carb_g, Fiber_g, Sugar_g"
15065,pollock atlantic raw,92.0,19.44,0.98,0.0,0.0,0.0,"Carb_g, Fiber_g, Sugar_g"
15066,fish pollock alaska raw (may have been previously frozen),56.0,12.19,0.41,0.0,0.0,0.0,"Carb_g, Fiber_g, Sugar_g"
15067,fish pollock alaska ckd dry heat (maybe previously frozen),111.0,23.48,1.18,0.0,0.0,0.0,"Carb_g, Fiber_g, Sugar_g"
15068,pompano florida raw,164.0,18.48,9.47,0.0,0.0,0.0,"Carb_g, Fiber_g, Sugar_g"
15069,pompano florida ckd dry heat,211.0,23.69,12.14,0.0,0.0,0.0,"Carb_g, Fiber_g, Sugar_g"
15070,rockfish pacific mxd sp raw,90.0,18.36,1.34,0.0,0.0,0.0,"Carb_g, Fiber_g, Sugar_g"
15071,rockfish pacific mxd sp ckd dry heat,109.0,22.23,1.62,0.0,0.0,0.0,"Carb_g, Fiber_g, Sugar_g"
15072,roe mixed species raw,143.0,22.32,6.42,1.5,0.0,0.0,"Fiber_g, Sugar_g"
