NDB_No,Descrip,Energy_kcal,Protein_g,Fat_g,Carb_g,Fiber_g,Sugar_g,zero_in
7069,salami ckd bfpork,336.0,21.85,25.9,2.4,0.0,0.96,Fiber_g
7071,salami dry or hard pork,407.0,22.58,33.72,1.6,0.0,0.0,"Fiber_g, Sugar_g"
7072,salami dry or hard pork bf,378.0,21.07,31.65,0.72,0.0,0.26,Fiber_g
7073,sandwich spread pork beef,235.0,7.66,17.34,11.94,0.2,0.0,Sugar_g
7074,smoked link sausage pork,309.0,11.98,28.23,0.94,0.0,0.94,Fiber_g
7075,sausage smoked link sausage pork  bf,320.0,12.0,28.73,2.42,0.0,0.0,"Fiber_g, Sugar_g"
7077,smoked link sausage porkbf nonfat dry milk,313.0,13.28,27.61,1.92,0.0,0.0,"Fiber_g, Sugar_g"
7078,thuringer cervelat smmr sausage bf pork,362.0,17.45,30.43,3.33,0.0,0.85,Fiber_g
7081,turkey breast sliced prepackaged,106.0,14.81,3.77,2.2,0.0,0.91,Fiber_g
7083,sausage vienna cnd chick bf pork,230.0,10.5,19.4,2.6,0.0,0.0,"Fiber_g, Sugar_g"
7088,honey roll sausage beef,182.0,18.58,10.5,2.18,0.0,0.0,"Fiber_g, Sugar_g"
7090,luncheon sausage porkbf,260.0,15.38,20.9,1.58,0.0,0.0,"Fiber_g, Sugar_g"
7091,new england brand sausage pork bf,161.0,17.27,7.58,4.83,0.0,0.0,"Fiber_g, Sugar_g"
7201,oscar mayer bologna (beef),316.0,11.05,29.1,2.45,0.0,1.4,Fiber_g
7209,oscar mayer  chicken breast (honey glazed),109.0,19.85,1.5,4.3,0.0,4.3,Fiber_g
7212,oscar mayer ham (chopped w nat juice),180.0,16.3,11.15,3.65,0.0,2.2,Fiber_g
7230,oscar mayer salami (hard),368.0,25.9,28.7,1.6,0.0,0.2,Fiber_g
7236,oscar mayer smokies sausage little chs (pork turkey),315.0,13.5,28.2,1.7,0.0,0.3,Fiber_g
7241,oscar mayer wieners (beef franks),329.0,11.35,30.26,2.78,0.0,1.6,Fiber_g
7254,turkey bacon unprep,226.0,15.94,16.93,1.89,0.0,0.0,"Fiber_g, Sugar_g"
7278,hormel pillow pak sliced turkey pepperoni,243.0,30.99,11.52,3.78,0.0,0.0,"Fiber_g, Sugar_g"
7900,turkey pork bf sausage lofat smoked,101.0,8.0,2.5,11.54,0.6,0.0,Sugar_g
7901,usda commodity pork sausage bulklinkspatties frz ckd,267.0,19.76,20.26,0.0,0.0,0.0,"Carb_g, Fiber_g, Sugar_g"
7905,frankfurter bf pork  turkey fat free,109.0,12.5,1.59,11.21,0.0,0.0,"Fiber_g, Sugar_g"
7906,luncheon meat pork ham chick mincd cnd red na vit c  (spam),293.0,12.5,25.1,3.4,0.0,0.0,"Fiber_g, Sugar_g"
7907,usda commodity pork sausage bulklinkspatties frz raw,231.0,14.95,18.56,0.0,0.0,0.0,"Carb_g, Fiber_g, Sugar_g"
7908,luncheon meat pork wham minced cnd incl spam (hormel),315.0,13.4,26.6,4.6,0.0,0.0,"Fiber_g, Sugar_g"
7909,luncheon meat porkchick minced cnd incl spam lite,196.0,15.23,13.9,1.35,0.0,1.26,Fiber_g
7910,bratwurst  veal  ckd,341.0,13.99,31.7,0.0,0.0,0.0,"Carb_g, Fiber_g, Sugar_g"
7914,sausage  italian  swt  links,149.0,16.13,8.42,2.1,0.0,0.0,"Fiber_g, Sugar_g"
7915,sausage  polish  bf w chick  hot,259.0,17.6,19.4,3.6,0.0,0.0,"Fiber_g, Sugar_g"
7916,sausage  polish  pork  bf  smoked,301.0,12.07,26.56,1.98,0.0,0.0,"Fiber_g, Sugar_g"
7917,sausage  pork  bf  w cheddar chs  smoked,296.0,12.89,25.84,2.13,0.0,0.11,Fiber_g
7919,sausage  turkey  brkfst links  mild,235.0,15.42,18.09,1.56,0.0,0.0,"Fiber_g, Sugar_g"
7920,swisswurst  pork  bf  w swiss chs  smoked,307.0,12.69,27.37,1.6,0.0,0.0,"Fiber_g, Sugar_g"
7921,bacon  bf stks,517.0,29.1,44.2,0.8,0.0,0.8,Fiber_g
7922,bratwurst  bf  pork  smoked,297.0,12.2,26.34,2.0,0.0,0.0,"Fiber_g, Sugar_g"
7923,bratwurst chick ckd,176.0,19.44,10.35,0.0,0.0,0.0,"Carb_g, Fiber_g, Sugar_g"
7924,bratwurst  pork  bf  turkey  lite  smoked,186.0,14.45,13.53,1.62,0.0,1.57,Fiber_g
7925,pastrami  bf  98 fat-free,95.0,19.6,1.16,1.54,0.0,0.0,"Fiber_g, Sugar_g"
7926,salami  italian  pork,425.0,21.7,37.0,1.2,0.0,1.2,Fiber_g
7928,sausage  chick  bf  pork  skinless  smoked,216.0,13.6,14.3,8.1,0.0,1.9,Fiber_g
7930,yachtwurst w pistachio nuts ckd,268.0,14.8,22.6,1.4,0.0,0.0,"Fiber_g, Sugar_g"
7931,beerwurst  pork  bf,276.0,14.0,22.53,4.27,0.9,0.0,Sugar_g
7932,chicken breast  fat-free  mesq flavor  sliced,80.0,16.8,0.39,2.25,0.0,0.2,Fiber_g
7933,chicken breast  oven-roasted  fat-free  sliced,79.0,16.79,0.39,2.17,0.0,0.1,Fiber_g
7934,kielbasa polish turkey  bf smoked,226.0,13.1,17.6,3.9,0.0,0.0,"Fiber_g, Sugar_g"
7935,oven-roasted chick breast roll,134.0,14.59,7.65,1.79,0.0,0.43,Fiber_g
7936,bologna  pork  turkey  lite,211.0,13.06,16.06,3.45,0.0,0.0,"Fiber_g, Sugar_g"
7937,bologna  pork  turkey  bf,336.0,11.56,29.25,6.66,0.0,1.35,Fiber_g
7938,ham  honey  smoked  ckd,122.0,17.93,2.37,7.27,0.0,0.0,"Fiber_g, Sugar_g"
7939,frankfurter pork,269.0,12.81,23.68,0.28,0.1,0.0,Sugar_g
7940,macaroni  chs loaf  chick  pork  bf,228.0,11.76,14.96,11.63,0.0,0.0,"Fiber_g, Sugar_g"
7941,salami  italian  pork  bf  dry  sliced  50 less na,350.0,21.8,26.4,6.4,0.0,0.0,"Fiber_g, Sugar_g"
7942,pate  truffle flavor,327.0,11.2,28.5,6.3,0.0,0.0,"Fiber_g, Sugar_g"
7943,turkey breast smoked lemon pepper flavor 97 fat-free,95.0,20.9,0.69,1.31,0.0,0.0,"Fiber_g, Sugar_g"
7945,frankfurter  bf  htd,322.0,11.69,29.36,2.66,0.0,1.27,Fiber_g
7949,frankfurter  meat  htd,278.0,9.77,24.31,4.9,0.0,0.0,"Fiber_g, Sugar_g"
7950,frankfurter  meat,290.0,10.26,25.76,4.17,0.0,0.0,"Fiber_g, Sugar_g"
7952,bologna chick turkey pork,298.0,9.88,26.18,5.65,0.0,0.0,"Fiber_g, Sugar_g"
7953,pork sausage linkpatty fully ckd microwaved,438.0,15.12,41.66,0.62,0.0,0.62,Fiber_g
7954,beef sausage pre-cooked,405.0,15.5,37.57,0.03,0.0,0.0,"Fiber_g, Sugar_g"
7955,turkey sausage frsh raw,155.0,18.79,8.08,0.47,0.0,0.0,"Fiber_g, Sugar_g"
7956,beef sausage frsh ckd,332.0,18.21,27.98,0.35,0.0,0.0,"Fiber_g, Sugar_g"
7957,pork  turkey sausage pre-cooked,342.0,12.05,30.64,3.63,0.0,0.0,"Fiber_g, Sugar_g"
7958,turkey sausage frsh ckd,196.0,23.89,10.44,0.0,0.0,0.0,"Carb_g, Fiber_g, Sugar_g"
7959,bologna chick pork bf,272.0,11.33,22.73,5.61,0.0,0.0,"Fiber_g, Sugar_g"
7960,bologna chick pork,336.0,10.31,30.61,4.19,0.0,0.0,"Fiber_g, Sugar_g"
7961,chicken breast deli rotisserie seasoned sliced prepackaged,98.0,17.4,1.86,2.92,0.0,0.75,Fiber_g
7962,frankfurter  meat and poultry  unheated,277.0,9.72,24.18,5.02,0.0,2.75,Fiber_g
7963,frankfurter  meat and poultry  cooked  boiled,298.0,10.31,26.28,4.96,0.0,2.7,Fiber_g
7964,frankfurter  meat and poultry  cooked  grilled,302.0,10.67,26.43,5.24,0.0,2.85,Fiber_g
7965,pork sausage linkpatty red fat unprep,217.0,16.75,16.55,0.2,0.0,0.0,"Fiber_g, Sugar_g"
7966,pork sausage linkpatty red fat ckd pan-fried,267.0,20.94,20.32,0.15,0.0,0.0,"Fiber_g, Sugar_g"
7967,pork sausage linkpatty fully ckd unhtd,392.0,13.46,37.25,0.69,0.0,0.53,Fiber_g
7968,kielbasa fully ckd grilled,337.0,12.45,29.68,5.03,0.0,2.39,Fiber_g
7969,kielbasa fully ckd pan-fried,333.0,12.36,29.43,4.78,0.0,2.38,Fiber_g
7970,kielbasa fully ckd unhtd,325.0,10.84,29.63,3.72,0.0,2.05,Fiber_g
7971,bologna meat  poultry,281.0,10.34,23.77,6.31,0.0,1.97,Fiber_g
7973,turkey bacon microwaved,368.0,29.5,25.87,4.24,0.0,4.24,Fiber_g
7974,bacon turkey lo na,253.0,13.33,20.0,4.8,0.0,0.0,"Fiber_g, Sugar_g"
7976,sausage chick or turkey italian style lower na,183.0,21.43,4.46,14.25,0.0,0.81,Fiber_g
7977,ham smoked ex ln lo na,141.0,18.52,2.71,10.7,0.0,10.68,Fiber_g
7978,pork sausage red na ckd,271.0,9.41,22.35,8.13,0.0,0.0,"Fiber_g, Sugar_g"
8066,cereals rte quaker quaker puffed rice,383.0,7.01,0.9,87.78,1.4,0.0,Sugar_g
8116,cereals malt-o-meal original pln dry,365.0,11.8,0.7,77.25,2.1,0.0,Sugar_g
8143,cereals wheatena ckd w h2o,56.0,2.0,0.5,11.8,2.7,0.0,Sugar_g
8156,cereals rte rice puffed fort,402.0,6.3,0.5,89.8,1.7,0.0,Sugar_g
8157,cereals rte wheat puffed fort,364.0,14.7,1.2,79.6,4.4,0.0,Sugar_g
8172,cereals farina unenr dry,369.0,10.6,0.5,78.0,1.9,0.0,Sugar_g
8236,cereals qkr oat bran prep wh2o no salt,43.0,2.03,0.95,7.49,1.7,0.0,Sugar_g
8240,cereals oat bran qkr qkrmother's oat bran prep wh2o salt,43.0,2.03,0.95,7.49,1.7,0.0,Sugar_g
8249,cereals quaker quaker multigrain oatmeal prep wh2o no salt,61.0,2.08,0.47,13.49,2.2,0.0,Sugar_g
8252,cereals quaker quaker multigrain oatmeal prep wh2o salt,61.0,2.07,0.47,13.47,2.2,0.0,Sugar_g
8363,cereals rte sun country kretschmer tstd wheat bran,200.0,17.56,5.16,59.51,41.3,0.0,Sugar_g
8580,incaparina dry mix (corn  soy flours) unprep,379.0,21.75,5.58,60.53,9.9,0.0,Sugar_g
9001,acerola (west indian cherry) raw,32.0,0.4,0.3,7.69,1.1,0.0,Sugar_g
9010,apples dehyd (lo moist) sulfured stwd,74.0,0.28,0.12,19.91,2.6,0.0,Sugar_g
9013,apples dried sulfured stwd w sugar,83.0,0.2,0.07,20.73,1.9,0.0,Sugar_g
9015,apples frz unswtnd htd,47.0,0.29,0.33,12.0,1.3,0.0,Sugar_g
9023,apricots cnd h2o pk woskn solliquids,22.0,0.69,0.03,5.48,1.1,0.0,Sugar_g
9025,apricots cnd ex lt syrup pk wskn solliquids,49.0,0.6,0.1,12.5,1.6,0.0,Sugar_g
9028,apricots cnd hvy syrup pk woskn solliquids,83.0,0.51,0.09,21.45,1.6,0.0,Sugar_g
9029,apricots cnd ex hvy syrup pk woskn solliquids,96.0,0.55,0.04,24.85,1.6,0.0,Sugar_g
9030,apricots dehyd (low-moisture) sulfured unckd,320.0,4.9,0.62,82.89,0.0,0.0,"Fiber_g, Sugar_g"
9031,apricots dehyd (low-moisture) sulfured stwd,126.0,1.93,0.24,32.62,0.0,0.0,"Fiber_g, Sugar_g"
9034,apricots dried sulfured stwd w sugar,113.0,1.17,0.15,29.26,4.1,0.0,Sugar_g
9035,apricots frozen sweetened,98.0,0.7,0.1,25.1,2.2,0.0,Sugar_g
9053,blueberries wild frz,57.0,0.0,0.16,13.85,4.4,0.0,"Protein_g, Sugar_g"
9056,boysenberries cnd hvy syrup,88.0,0.99,0.12,22.31,2.6,0.0,Sugar_g
9061,carissa (natal-plum) raw,62.0,0.5,1.3,13.63,0.0,0.0,"Fiber_g, Sugar_g"
9065,cherries sour red cnd lt syrup pk solliquids,75.0,0.74,0.1,19.3,0.8,0.0,Sugar_g
9067,cherries sour red cnd ex hvy syrup pk solliquids,114.0,0.71,0.09,29.23,0.8,0.0,Sugar_g
9075,cherries swt cnd ex hvy syrup pk solliquids,102.0,0.59,0.15,26.23,1.5,0.0,Sugar_g
9077,crabapples raw,76.0,0.4,0.3,19.95,0.0,0.0,"Fiber_g, Sugar_g"
9082,cranberry-orange relish cnd,178.0,0.3,0.1,46.2,0.0,0.0,"Fiber_g, Sugar_g"
9083,currants european black raw,63.0,1.4,0.41,15.38,0.0,0.0,"Fiber_g, Sugar_g"
9086,custard-apple (bullock's-heart) raw,101.0,1.7,0.6,25.2,2.4,0.0,Sugar_g
9088,elderberries raw,73.0,0.66,0.5,18.4,7.0,0.0,Sugar_g
9093,figs cnd ex hvy syrup pk solliquids,107.0,0.38,0.1,27.86,0.0,0.0,"Fiber_g, Sugar_g"
9098,fruit cocktail cnd ex lt syrup solliquids,45.0,0.4,0.07,11.63,1.1,0.0,Sugar_g
9101,fruit cocktail cnd ex hvy syrup solliquids,88.0,0.39,0.07,22.89,1.1,0.0,Sugar_g
9102,fruit salad cnd h2o pk solliquids,30.0,0.35,0.07,7.87,1.0,0.0,Sugar_g
9103,fruit salad cnd juc pk solliquids,50.0,0.51,0.03,13.05,1.0,0.0,Sugar_g
9104,fruit salad cnd lt syrup solliquids,58.0,0.34,0.07,15.14,1.0,0.0,Sugar_g
9106,fruit salad cnd ex hvy syrup solliquids,88.0,0.33,0.06,22.77,1.0,0.0,Sugar_g
9107,gooseberries raw,44.0,0.88,0.58,10.18,4.3,0.0,Sugar_g
9109,gooseberries cnd lt syrup pk solliquids,73.0,0.65,0.2,18.75,2.4,0.0,Sugar_g
9113,grapefruit raw pinkred californiaarizona,37.0,0.5,0.1,9.69,0.0,0.0,"Fiber_g, Sugar_g"
9114,grapefruit raw pink  red florida,30.0,0.55,0.1,7.5,1.1,0.0,Sugar_g
9117,grapefruit raw white california,37.0,0.88,0.1,9.09,0.0,0.0,"Fiber_g, Sugar_g"
9118,grapefruit raw white florida,32.0,0.63,0.1,8.19,0.0,0.0,"Fiber_g, Sugar_g"
9127,grapefruit juc pink or red w added ca,38.0,0.5,0.1,8.69,0.0,8.33,Fiber_g
9129,grapes  muscadine  raw,57.0,0.81,0.47,13.93,3.9,0.0,Sugar_g
9138,groundcherries (cape-gooseberries or poha) raw,53.0,1.9,0.7,11.2,0.0,0.0,"Fiber_g, Sugar_g"
9140,guavas strawberry raw,69.0,0.58,0.6,17.36,5.4,0.0,Sugar_g
9145,java-plum (jambolan) raw,60.0,0.72,0.23,15.56,0.0,0.0,"Fiber_g, Sugar_g"
9146,jujube raw,79.0,1.2,0.2,20.23,0.0,0.0,"Fiber_g, Sugar_g"
9147,jujube chinese frsh dried,281.0,4.72,0.5,72.52,6.0,0.0,Sugar_g
9172,longans raw,60.0,1.31,0.1,15.14,1.1,0.0,Sugar_g
9173,longans dried,286.0,4.9,0.4,74.0,0.0,0.0,"Fiber_g, Sugar_g"
9174,loquats raw,47.0,0.43,0.2,12.14,1.7,0.0,Sugar_g
9175,mammy-apple (mamey) raw,51.0,0.5,0.5,12.5,3.0,0.0,Sugar_g
9177,mangosteen cnd syrup pk,73.0,0.41,0.58,17.91,1.8,0.0,Sugar_g
9185,melon balls frozen,33.0,0.84,0.25,7.94,0.7,0.0,Sugar_g
9192,oheloberries raw,28.0,0.38,0.22,6.84,0.0,0.0,"Fiber_g, Sugar_g"
9193,olives ripe cnd (small-extra lrg),115.0,0.84,10.68,6.26,3.2,0.0,Sugar_g
9194,olives ripe cnd (jumbo-super colossal),81.0,0.97,6.87,5.61,2.5,0.0,Sugar_g
9201,oranges raw california valencias,49.0,1.04,0.3,11.89,2.5,0.0,Sugar_g
9205,oranges raw with peel,63.0,1.3,0.3,15.5,4.5,0.0,Sugar_g
9216,orange peel raw,97.0,1.5,0.2,25.0,10.6,0.0,Sugar_g
9239,peaches cnd ex lt syrup solliquids,42.0,0.4,0.1,11.1,1.0,0.0,Sugar_g
9242,peaches cnd ex hvy syrup pk solliquids,96.0,0.47,0.03,26.06,1.0,0.0,Sugar_g
9244,peaches dehyd (low-moisture) sulfured unckd,325.0,4.89,1.03,83.18,0.0,0.0,"Fiber_g, Sugar_g"
9245,peaches dehyd (low-moisture) sulfured stwd,133.0,2.01,0.42,34.14,0.0,0.0,"Fiber_g, Sugar_g"
9248,peaches dried sulfured stwd w sugar,103.0,1.06,0.22,26.6,2.4,0.0,Sugar_g
9255,pears cnd ex lt syrup pk solliquids,47.0,0.3,0.1,12.2,1.6,0.0,Sugar_g
9258,pears cnd ex hvy syrup pk solliquids,97.0,0.19,0.13,25.25,1.6,0.0,Sugar_g
9261,pears dried sulfured stwd w sugar,140.0,0.86,0.29,37.14,5.8,0.0,Sugar_g
9264,persimmons japanese dried,274.0,1.38,0.59,73.43,14.5,0.0,Sugar_g
9265,persimmons native raw,127.0,0.8,0.4,33.5,0.0,0.0,"Fiber_g, Sugar_g"
9271,pineapple cnd ex hvy syrup pk solliquids,83.0,0.34,0.11,21.5,0.8,0.0,Sugar_g
9276,pitanga (surinam-cherry) raw,33.0,0.8,0.4,7.49,0.0,0.0,"Fiber_g, Sugar_g"
9285,plums cnd purple ex hvy syrup pk solliquids,101.0,0.36,0.1,26.31,1.0,0.0,Sugar_g
9287,prickly pears raw,41.0,0.73,0.51,9.57,3.6,0.0,Sugar_g
9288,prunes cnd hvy syrup pk solliquids,105.0,0.87,0.2,27.8,3.8,0.0,Sugar_g
9289,prunes dehyd (low-moisture) unckd,339.0,3.7,0.73,89.07,0.0,0.0,"Fiber_g, Sugar_g"
9290,prunes dehyd (low-moisture) stwd,113.0,1.23,0.24,29.7,0.0,0.0,"Fiber_g, Sugar_g"
9293,plums dried (prunes) stwd w added sugar,124.0,1.09,0.22,32.88,3.8,0.0,Sugar_g
9295,pummelo raw,38.0,0.76,0.04,9.62,1.0,0.0,Sugar_g
9296,quinces raw,57.0,0.4,0.1,15.3,1.9,0.0,Sugar_g
9299,raisins seeded,296.0,2.52,0.54,78.47,6.8,0.0,Sugar_g
9301,rambutan cnd syrup pk,82.0,0.65,0.21,20.87,0.9,0.0,Sugar_g
9311,roselle raw,49.0,0.96,0.64,11.31,0.0,0.0,"Fiber_g, Sugar_g"
9312,rose-apples raw,25.0,0.6,0.3,5.7,0.0,0.0,"Fiber_g, Sugar_g"
9313,sapodilla raw,83.0,0.44,1.1,19.96,5.3,0.0,Sugar_g
9321,sugar-apples (sweetsop) raw,94.0,2.06,0.29,23.64,4.4,0.0,Sugar_g
9325,fruit salad tropical cnd hvy syrup solliquids,86.0,0.41,0.1,22.36,1.3,0.0,Sugar_g
9402,applesauce cnd swtnd wsalt,76.0,0.18,0.18,19.91,1.2,0.0,Sugar_g
9404,grapefruit juice pink raw,39.0,0.5,0.1,9.2,0.0,0.0,"Fiber_g, Sugar_g"
9410,apple juc frz conc unswtnd undil w vit c,166.0,0.51,0.37,41.0,0.0,38.83,Fiber_g
9411,apple juc frz conc unswtnd dil w3 volume h2o w vit c,47.0,0.14,0.1,11.54,0.1,0.0,Sugar_g
9420,jackfruit cnd syrup pk,92.0,0.36,0.14,23.94,0.9,0.0,Sugar_g
9422,durian raw or frozen,147.0,1.47,5.33,27.09,3.8,0.0,Sugar_g
9429,pineapple raw traditional var,45.0,0.55,0.13,11.82,0.0,8.29,Fiber_g
9451,horned melon (kiwano),44.0,1.78,1.26,7.56,0.0,0.0,"Fiber_g, Sugar_g"
9507,fruit juc smoothie naked juc mighty mango,63.0,0.42,0.0,15.0,0.0,12.5,"Fat_g, Fiber_g"
9511,fruit juc smoothie naked juc blue machine,71.0,0.42,0.0,16.67,2.9,12.08,Fat_g
9514,fruit juc smoothie bolthouse farms berry boost,46.0,0.63,0.02,10.9,0.0,9.3,Fiber_g
9523,lemon juc from conc btld concord,24.0,0.4,0.07,5.37,0.0,1.42,Fiber_g
10000,pork frsh comp of fat w added soln ckd,585.0,10.06,60.42,0.32,0.0,0.0,"Fiber_g, Sugar_g"
10001,pork frsh carcass lnfat raw,376.0,13.91,35.07,0.0,0.0,0.0,"Carb_g, Fiber_g, Sugar_g"
10002,pork frsh comp of rtl cuts (leg loin shldr) ln raw,134.0,21.2,4.86,0.0,0.0,0.0,"Carb_g, Fiber_g, Sugar_g"
10003,pork frsh comp of leg loin shldr  spareribs ln  fat raw,211.0,18.22,14.79,0.0,0.0,0.0,"Carb_g, Fiber_g, Sugar_g"
10004,pork fresh backfat raw,812.0,2.92,88.69,0.0,0.0,0.0,"Carb_g, Fiber_g, Sugar_g"
10005,pork frsh belly raw,518.0,9.34,53.01,0.0,0.0,0.0,"Carb_g, Fiber_g, Sugar_g"
10006,pork frsh fat raw,632.0,9.25,65.7,0.0,0.0,0.0,"Carb_g, Fiber_g, Sugar_g"
10007,pork frsh fat ckd,626.0,7.06,66.1,0.0,0.0,0.0,"Carb_g, Fiber_g, Sugar_g"
10008,pork frsh leg (ham) whl lnfat raw,245.0,17.43,18.87,0.0,0.0,0.0,"Carb_g, Fiber_g, Sugar_g"
10009,pork frsh leg (ham) whl lnfat ckd rstd,273.0,26.83,17.61,0.0,0.0,0.0,"Carb_g, Fiber_g, Sugar_g"
10010,pork frsh leg (ham) whl ln raw,136.0,20.48,5.41,0.0,0.0,0.0,"Carb_g, Fiber_g, Sugar_g"
10011,pork frsh leg (ham) whl ln ckd rstd,211.0,29.41,9.44,0.0,0.0,0.0,"Carb_g, Fiber_g, Sugar_g"
10012,pork frsh leg (ham) rump half lnfat raw,182.0,20.27,10.63,0.0,0.0,0.0,"Carb_g, Fiber_g, Sugar_g"
10013,pork frsh leg (ham) rump half lnfat ckd rstd,209.0,27.03,10.32,0.0,0.0,0.0,"Carb_g, Fiber_g, Sugar_g"
10014,pork frsh leg (ham) rump half ln raw,120.0,21.81,2.93,0.0,0.0,0.0,"Carb_g, Fiber_g, Sugar_g"
10015,pork frsh leg (ham) rump half ln ckd rstd,165.0,28.86,4.62,0.0,0.0,0.0,"Carb_g, Fiber_g, Sugar_g"
10016,pork frsh leg (ham) shank half lnfat raw,193.0,19.87,11.96,0.0,0.0,0.0,"Carb_g, Fiber_g, Sugar_g"
10017,pork frsh leg (ham) shank half lnfat ckd rstd,232.0,25.96,13.42,0.0,0.0,0.0,"Carb_g, Fiber_g, Sugar_g"
10018,pork frsh leg (ham) shank half ln raw,119.0,21.66,2.95,0.0,0.0,0.0,"Carb_g, Fiber_g, Sugar_g"
10019,pork frsh leg (ham) shank half ln ckd rstd,175.0,28.69,5.83,0.0,0.0,0.0,"Carb_g, Fiber_g, Sugar_g"
10020,pork frsh loin whl lnfat raw,198.0,19.74,12.58,0.0,0.0,0.0,"Carb_g, Fiber_g, Sugar_g"
10021,pork frsh loin whl lnfat ckd brsd,239.0,27.23,13.62,0.0,0.0,0.0,"Carb_g, Fiber_g, Sugar_g"
10022,pork frsh loin whl lnfat ckd brld,242.0,27.32,13.92,0.0,0.0,0.0,"Carb_g, Fiber_g, Sugar_g"
10023,pork frsh loin whl lnfat ckd rstd,248.0,27.09,14.65,0.0,0.0,0.0,"Carb_g, Fiber_g, Sugar_g"
10024,pork frsh loin whl ln raw,143.0,21.43,5.66,0.0,0.0,0.0,"Carb_g, Fiber_g, Sugar_g"
10025,pork frsh loin whl ln ckd brsd,204.0,28.57,9.12,0.0,0.0,0.0,"Carb_g, Fiber_g, Sugar_g"
10026,pork frsh loin whl ln ckd brld,210.0,28.57,9.8,0.0,0.0,0.0,"Carb_g, Fiber_g, Sugar_g"
10027,pork frsh loin whl ln ckd rstd,209.0,28.62,9.63,0.0,0.0,0.0,"Carb_g, Fiber_g, Sugar_g"
10028,pork frsh loin blade (chops or roasts) bone-in lnfat raw,194.0,19.56,12.27,0.0,0.0,0.0,"Carb_g, Fiber_g, Sugar_g"
10029,pork frsh loin blade (chops) bone-in lnfat ckd brsd,255.0,26.54,15.71,0.0,0.0,0.0,"Carb_g, Fiber_g, Sugar_g"
10030,pork frsh loin blade (chops) bone-in lnfat ckd brld,231.0,23.72,14.35,0.0,0.0,0.0,"Carb_g, Fiber_g, Sugar_g"
10031,pork frsh loin blade (roasts) bone-in lnfat ckd rstd,254.0,24.29,16.71,0.0,0.0,0.0,"Carb_g, Fiber_g, Sugar_g"
10032,pork frsh loin blade (chops or roasts) bone-in ln raw,143.0,21.22,5.84,0.0,0.0,0.0,"Carb_g, Fiber_g, Sugar_g"
10033,pork frsh loin blade (chops) bone-in ln ckd brsd,222.0,28.02,11.29,0.0,0.0,0.0,"Carb_g, Fiber_g, Sugar_g"
10034,pork frsh loin blade (chops) bone-in ln ckd brld,193.0,24.99,9.56,0.0,0.0,0.0,"Carb_g, Fiber_g, Sugar_g"
10035,pork frsh loin blade (roasts) bone-in ln ckd rstd,217.0,25.7,11.89,0.0,0.0,0.0,"Carb_g, Fiber_g, Sugar_g"
10036,pork frsh loin cntr loin (chops) bone-in ln  fat raw,170.0,20.71,9.03,0.0,0.0,0.0,"Carb_g, Fiber_g, Sugar_g"
10037,pork frsh loin cntr loin (chops) bone-in lnfat ckd brsd,242.0,28.21,13.51,0.0,0.0,0.0,"Carb_g, Fiber_g, Sugar_g"
10038,pork frsh loin cntr loin (chops) bone-in lnfat ckd brld,209.0,25.61,11.06,0.0,0.0,0.0,"Carb_g, Fiber_g, Sugar_g"
10039,pork frsh loin cntr loin (roasts) bone-in lnfat ckd rstd,231.0,27.01,12.8,0.0,0.0,0.0,"Carb_g, Fiber_g, Sugar_g"
10040,pork frsh loin cntr loin (chops) bone-in ln raw,127.0,21.99,3.71,0.0,0.0,0.0,"Carb_g, Fiber_g, Sugar_g"
10041,pork frsh loin cntr loin (chops) bone-in ln ckd brsd,200.0,30.2,7.86,0.0,0.0,0.0,"Carb_g, Fiber_g, Sugar_g"
10042,pork frsh loin cntr loin (chops) bone-in ln ckd brld,180.0,26.76,7.29,0.0,0.0,0.0,"Carb_g, Fiber_g, Sugar_g"
10043,pork frsh loin cntr loin (roasts) bone-in ln ckd rstd,194.0,28.58,7.95,0.0,0.0,0.0,"Carb_g, Fiber_g, Sugar_g"
10044,pork frsh loin cntr rib (chops or roasts) bone-in lnfat raw,186.0,20.28,11.04,0.0,0.0,0.0,"Carb_g, Fiber_g, Sugar_g"
10045,pork frsh loin cntr rib (chops) bone-in lnfat ckd brsd,261.0,26.66,16.28,0.0,0.0,0.0,"Carb_g, Fiber_g, Sugar_g"
10046,pork frsh loin cntr rib (chops) bone-in lnfat ckd brld,222.0,24.42,13.04,0.0,0.0,0.0,"Carb_g, Fiber_g, Sugar_g"
10047,pork frsh loin cntr rib (roasts) bone-in lnfat ckd rstd,248.0,26.99,14.68,0.0,0.0,0.0,"Carb_g, Fiber_g, Sugar_g"
10048,pork frsh loin cntr rib (chops or roasts) bone-in ln raw,136.0,21.79,4.8,0.0,0.0,0.0,"Carb_g, Fiber_g, Sugar_g"
10049,pork frsh loin cntr rib (chops) bone-in ln ckd brsd,208.0,29.03,9.32,0.0,0.0,0.0,"Carb_g, Fiber_g, Sugar_g"
10050,pork frsh loin cntr rib (chops) bone-in ln ckd brld,186.0,25.79,8.36,0.0,0.0,0.0,"Carb_g, Fiber_g, Sugar_g"
10051,pork frsh loin cntr rib (roasts) bone-in ln ckd rstd,206.0,28.82,9.21,0.0,0.0,0.0,"Carb_g, Fiber_g, Sugar_g"
10052,pork frsh loin sirloin (chops or roasts) bone-in lnfat raw,168.0,20.48,8.96,0.0,0.0,0.0,"Carb_g, Fiber_g, Sugar_g"
10053,pork frsh loin sirloin (chops) bone-in lnfat ckd brsd,234.0,28.81,12.31,0.0,0.0,0.0,"Carb_g, Fiber_g, Sugar_g"
10054,pork frsh loin sirloin (chops) bone-in lnfat ckd brld,222.0,26.96,11.82,0.0,0.0,0.0,"Carb_g, Fiber_g, Sugar_g"
10055,pork frsh loin sirloin (roasts) bone-in lnfat ckd rstd,230.0,26.64,12.87,0.0,0.0,0.0,"Carb_g, Fiber_g, Sugar_g"
10056,pork frsh loin sirloin (chops or roasts) bone-in ln raw,129.0,21.65,4.02,0.0,0.0,0.0,"Carb_g, Fiber_g, Sugar_g"
10057,pork frsh loin sirloin (chops) bone-in ln ckd brsd,195.0,31.0,6.9,0.0,0.0,0.0,"Carb_g, Fiber_g, Sugar_g"
10058,pork frsh loin sirloin (chops) bone-in ln ckd brld,174.0,29.29,5.45,0.0,0.0,0.0,"Carb_g, Fiber_g, Sugar_g"
10059,pork frsh loin sirloin (roasts) bone-in ln ckd rstd,204.0,27.78,9.44,0.0,0.0,0.0,"Carb_g, Fiber_g, Sugar_g"
10060,pork  frsh  loin  tenderloin   ln only  raw,109.0,20.95,2.17,0.0,0.0,0.0,"Carb_g, Fiber_g, Sugar_g"
10061,pork frsh loin tenderloin ln ckd rstd,143.0,26.17,3.51,0.0,0.0,0.0,"Carb_g, Fiber_g, Sugar_g"
10062,pork frsh loin top loin (chops) bnless ln  fat raw,155.0,21.55,6.94,0.0,0.0,0.0,"Carb_g, Fiber_g, Sugar_g"
10063,pork frsh loin top loin (chops) bnless ln  fat ckd brsd,200.0,29.2,8.31,0.0,0.0,0.0,"Carb_g, Fiber_g, Sugar_g"
10064,pork frsh loin top loin (chops) bnless ln  fat ckd brld,196.0,26.62,9.14,0.0,0.0,0.0,"Carb_g, Fiber_g, Sugar_g"
10065,pork frsh loin top loin (roasts) bnless lnfat ckd rstd,192.0,26.45,8.82,0.0,0.0,0.0,"Carb_g, Fiber_g, Sugar_g"
10066,pork frsh loin top loin (chops) bnless ln raw,127.0,22.41,3.42,0.0,0.0,0.0,"Carb_g, Fiber_g, Sugar_g"
10067,pork frsh loin top loin (chops) bnless ln ckd brsd,170.0,30.54,4.34,0.0,0.0,0.0,"Carb_g, Fiber_g, Sugar_g"
10068,pork frsh loin top loin (chops) bnless ln ckd brld,173.0,27.58,6.08,0.0,0.0,0.0,"Carb_g, Fiber_g, Sugar_g"
10069,pork frsh loin top loin (roasts) bnless ln ckd rstd,173.0,27.23,6.28,0.0,0.0,0.0,"Carb_g, Fiber_g, Sugar_g"
10070,pork frsh shldr whl lnfat raw,236.0,17.18,17.99,0.0,0.0,0.0,"Carb_g, Fiber_g, Sugar_g"
10071,pork frsh shldr whl lnfat ckd rstd,292.0,23.28,21.39,0.0,0.0,0.0,"Carb_g, Fiber_g, Sugar_g"
10072,pork frsh shldr whl ln raw,148.0,19.55,7.14,0.0,0.0,0.0,"Carb_g, Fiber_g, Sugar_g"
10073,pork frsh shldr whl ln ckd rstd,230.0,25.33,13.54,0.0,0.0,0.0,"Carb_g, Fiber_g, Sugar_g"
10074,pork frsh shldr arm picnic lnfat raw,193.0,18.71,12.51,0.0,0.0,0.0,"Carb_g, Fiber_g, Sugar_g"
10075,pork frsh shldr arm picnic lnfat ckd brsd,235.0,24.88,14.33,0.0,0.0,0.0,"Carb_g, Fiber_g, Sugar_g"
10076,pork frsh shldr arm picnic lnfat ckd rstd,317.0,23.47,24.01,0.0,0.0,0.0,"Carb_g, Fiber_g, Sugar_g"
10077,pork frsh shldr arm picnic ln raw,120.0,20.26,3.77,0.0,0.0,0.0,"Carb_g, Fiber_g, Sugar_g"
10078,pork frsh shldr arm picnic ln ckd brsd,194.0,26.76,8.87,0.0,0.0,0.0,"Carb_g, Fiber_g, Sugar_g"
10079,pork frsh shldr arm picnic ln ckd rstd,228.0,26.68,12.62,0.0,0.0,0.0,"Carb_g, Fiber_g, Sugar_g"
10080,pork frsh shldr (boston butt) blade (steaks) ln  fat raw,186.0,17.42,12.36,0.0,0.0,0.0,"Carb_g, Fiber_g, Sugar_g"
10081,pork frsh shldr (boston butt) blade (stks) ln  fat ckd brsd,267.0,25.07,17.69,0.0,0.0,0.0,"Carb_g, Fiber_g, Sugar_g"
10082,pork frsh shldr blade boston (steaks) lnfat ckd brld,259.0,25.58,16.61,0.0,0.0,0.0,"Carb_g, Fiber_g, Sugar_g"
10083,pork frsh shldr blade boston (roasts) lnfat ckd rstd,269.0,23.11,18.86,0.0,0.0,0.0,"Carb_g, Fiber_g, Sugar_g"
10084,pork frsh shldr (boston butt) blade (steaks) ln raw,132.0,18.73,5.71,0.0,0.0,0.0,"Carb_g, Fiber_g, Sugar_g"
10085,pork frsh shldr (boston butt) blade (steaks) ln ckd brsd,233.0,26.57,13.2,0.0,0.0,0.0,"Carb_g, Fiber_g, Sugar_g"
10086,pork frsh shldr blade boston (steaks) ln ckd brld,227.0,26.74,12.54,0.0,0.0,0.0,"Carb_g, Fiber_g, Sugar_g"
10087,pork frsh shldr blade boston (roasts) ln ckd rstd,232.0,24.21,14.3,0.0,0.0,0.0,"Carb_g, Fiber_g, Sugar_g"
10088,pork frsh spareribs lnfat raw,277.0,15.47,23.4,0.0,0.0,0.0,"Carb_g, Fiber_g, Sugar_g"
10089,pork frsh spareribs lnfat ckd brsd,397.0,29.06,30.3,0.0,0.0,0.0,"Carb_g, Fiber_g, Sugar_g"
10093,pork frsh comp of rtl cuts (leg loin shldr) ln ckd,201.0,27.51,9.21,0.0,0.0,0.0,"Carb_g, Fiber_g, Sugar_g"
10094,pork frsh loin cntr loin (chops) bnless ln raw,123.0,23.75,3.09,0.0,0.0,0.0,"Carb_g, Fiber_g, Sugar_g"
10096,pork frsh var meatsby-products brain raw,127.0,10.28,9.21,0.0,0.0,0.0,"Carb_g, Fiber_g, Sugar_g"
10097,pork frsh var meatsby-products brain ckd brsd,138.0,12.14,9.51,0.0,0.0,0.0,"Carb_g, Fiber_g, Sugar_g"
10098,pork frsh var meatsby-products chitterlings raw,182.0,7.64,16.61,0.0,0.0,0.0,"Carb_g, Fiber_g, Sugar_g"
10099,pork frsh var meatsby-products chitterlings ckd simmrd,233.0,12.49,20.32,0.0,0.0,0.0,"Carb_g, Fiber_g, Sugar_g"
10100,pork frsh var meatsby-products ears frz raw,234.0,22.45,15.1,0.6,0.0,0.0,"Fiber_g, Sugar_g"
10101,pork frsh var meatsby-products ears frz ckd simmrd,166.0,15.95,10.8,0.2,0.0,0.0,"Fiber_g, Sugar_g"
10102,pork frsh var meatsby-products feet raw,212.0,23.16,12.59,0.0,0.0,0.0,"Carb_g, Fiber_g, Sugar_g"
10103,pork frsh var meatsby-products heart raw,118.0,17.27,4.36,1.33,0.0,0.0,"Fiber_g, Sugar_g"
10104,pork frsh var meatsby-products heart ckd brsd,148.0,23.6,5.05,0.4,0.0,0.0,"Fiber_g, Sugar_g"
10105,pork frsh var meatsby-products jowl raw,655.0,6.38,69.61,0.0,0.0,0.0,"Carb_g, Fiber_g, Sugar_g"
